"authors","paper_count"
"Mayren Sánchez-Rosario; Diana Pérez-Staples; Jorge Toledo; Javier Valle-Mora; Pablo Liedo","1"
"Shaviklo, AR; Alizadeh-Ghamsari, AH; Hosseini, SA","1"
"Anany, EM; Ibrahim, MA; El-Razek, IMA; El-Nabawy, EM; Amer, AA; Zaineldin, AI; Gewaily, MS; Dawood, MAO","1"
"Gergs, A; Baden, CU","1"
"Nsa Dada, Natapong Jupatanakul, Guillaume Minard, Sarah Short, Jewelna Akorli, Luis Martinez Villegas","1"
"Jarett, JK; Carlson, A; Serao, MR; Strickland, J; Serfilippi, L; Ganz, HH","1"
"Dorper, A; Veldkamp, T; Dicke, M","1"
"Morgane Guégan, Karima Zouache, Colin Démichel, Guillaume Minard, Van Tran Van, Patrick Potier, Patrick Mavingui, and Claire Valiente Moro","1"
"Stéphane Fraichard; Arièle Legendre; Philippe Lucas; Isabelle Chauvel; Philippe Faure; Fabrice Neiers; Yves Artur; Loïc Briand; Jean-François Ferveur; Jean-Marie Heydel","1"
"Michele Caroline Lanan, Pedro Augusto Pos Rodrigues, Al Agellon, Patricia Jansma, Diana Esther Wheeler","1"
"Zhi-Xiang Dong, Yi-Fei Chen, Huan-Yuan Li, Qi-He Tang, and Jun Guo","1"
"Lijun Wang; Xinhui Liu; Zhengxing Liu; Xiaoping Wang; Chaoliang Lei; Fen Zhu","1"
"Archana Mishra, Ohad Afik, Miguel L Cabrera, Keith S Selaplane, Jason E Mowrer","1"
"Jichuan Cao; Tianxiong Yu; Bo Xu; Zhongren Hu; Xiao-ou Zhang; William E. Theurkauf; Zhiping Weng","1"
"Nogales-Merida, S; Gobbi, P; Jozefiak, D; Mazurkiewicz, J; Dudek, K; Rawski, M; Kieronczyk, B; Jozefiak, A","1"
"Suryati, T; Julaeha, E; Farabi, K; Ambarsari, H; Hidayat, AT","1"
"Hongchang Gu; Liang Wang; Xueze Lv; Weifang Yang; Li Zhang; Zebin Zhang; Tao Zhu; Yaxiong Jia; Yu Chen; Lujiang Qu.","1"
"Jorge Poveda","1"
"David Houben, Guillaume Daoulas, Michel-Pierre Faucon, Anne-Maïmiti Dulaurent","1"
"Vienna Kowallik, Alexander S. Mikheyev","1"
"Kowalska, J; Rawski, M; Homska, N; Mikolajczak, Z; Kieronczyk, B; Swiatkiewicz, S; Wachowiak, R; Hetmanczyk, K; Mazurkiewicz, J","1"
"Mediha Yildirim-Aksoy, Rashida Eljack, Cole Schrimsher, Benjamin H.Beck","1"
"Kari, ZA; Téllez-Isaías, G; Hamid, NKA; Rusli, ND; Mat, K; Sukri, SAM; Kabir, MA; Ishak, AR; Dom, NC; Abdel-Warith, AWA; Younis, EM; Khoo, MI; Abdullah, F; Shahjahan, M; Rohani, MF; Davies, SJ; Wei, LS","1"
"Chen, GZ; Zhang, K; Tang, WL; Li, YZ; Pang, JY; Yuan, X; Song, XB; Jiang, LL; Yu, X; Zhu, HW; Wang, J; Zhang, JL; Zhang, XX","1"
"Sarita Devi, Harvinder Singh Saini, Sanehdeep Kaur","1"
"Tomas N. Generalovic; Christoph Sandrock; Benjamin J. Roberts; Joana I. Meier; Martin Hauser; Ian A. Warren; Miha Pipan; Richard Durbin; Chris D. Jiggins","1"
"Wei Liu; Lei Chen; Shilai Zhang; Fengyi Hu; Zheng Wang; Jun Lyu; Bao Wang; Hui Xiang; Ruoping Zhao; Zhixi Tian; Song Ge; Wen Wang","1"
"Matteo Callegari, Costanza Jucker, Marco Fusi, Maria Giovanna Leonardi, Daniele Daffonchio, Sara Borin, Sara Savoldelli, Elena Crotti","1"
"Jessamina E. Blum, Caleb N. Fischer, Jessica Miles, Jo Handelsman","1"
"Daniel Stribling; Peter L. Chang; Justin E. Dalton; Christopher A. Conow; Malcolm Rosenthal; Eileen Hebets; Rita M. Graze; Michelle N. Arbeitman","1"
"Kirsten I. Verster; Gyöngyi Cinege; Zoltán Lipinszki; Lilla B. Magyar; Éva Kurucz; Rebecca L. Tarnopol; Edit Ábrahám; Zsuzsanna Darula; Marianthi Karageorgi; Josephine A. Tamsil; Saron M. Akalu; István Andó; Noah K. Whiteman","1"
"Masasuke Ryuda; Seiji Tsuzuki; TeiichiTanimura; Sumio Tojo; Yoichi Hayakawa","1"
"Lalander, CH; Fidjeland, J; Diener, S; Eriksson, S; Vinneras, B","1"
"Shanshan Gao; Shumei Liu; Tian Gao; Xinyi Zhang; Zhuangkun Huo; Kunpeng Zhang","1"
"Lu Li; Yu‐Qin Wang; Guang‐Ya Li; Qi‐Sheng Song; David Stanley; Shu‐Jun Wei; Jia‐Ying Zhu","1"
"Xing Li; Yong Wang; Chengcheng Cai; Jialei Ji; Fengqing Han; Lei Zhang; Shumin Chen; Lingkui Zhang; Yinqing Yang; Qi Tang; Johan Bucher; Xuelin Wang; Limei Yang; Mu Zhuang; Kang Zhang; Honghao Lv; Guusje Bonnema; Yangyong Zhang; Feng Cheng","1"
"Alisdair R. Fernie; Saleh Alseekh; Jie Liu; Jianbing Yan","1"
"Charity G. Owings; William P. Gilhooly; Christine J. Picard","1"
"Marwa Shumo, Fathiya M Khamis, Fidelis Levi Ombura, Chrysantus M Tanga, Komi K M Fiaboe, Sevgan Subramanian, Sunday Ekesi, Oliver K Schluter, Arnold van Huis, Christian Borgemeister","1"
"Yildirim-Aksoy, M; Eljack, R; Beck, BH","1"
"Naoko Toshima; Chieko Hara; Claus-Jürgen Scholz; Teiichi Tanimura","1"
"Hu, ZC; Li, HD; Liu, S; Xue, RR; Sun, J; Ji, H","1"
"Agata Jozefiak, Silvia Nogales-Merida, Mateusz Rawskim Bartosz Kieronczyk, Jan Mazurkiewicz","1"
"Li, MM; Wang, GY; Shang, RS; Xu, QL; Zhang; Sun, R; Li, LS.","1"
"Y. Miyagawa, J. M. Lee, T. Maeda, K. Koga, Y. Kawaguchi, T. Kusakabe","1"
"Wan-Ying Dong; Yao Wang; Zhong-Shi Zhou; Jian-Ying Guo","1"
"Xiang, JH; Qin, L; Zhao, D; Xiong, F; Wang, GT; Zou, H; Li, WX; Li, M; Song, KB; Wu, SG","1"
"Talwinder Kaur, Arti Vasudev, Satwinder Kaur Sohal, Rajesh Kumari Manhas","1"
"Pratyajit Mohapatra; Karen Menuz","1"
"Karen L Adair, Alyssa Bost Eduardo Bueno, Sipa Kauisto, Raine Kortet, Grace Peters-Schulze, Vincent G Martinson, Angela E. Douglas","1"
"Gunilla Ståhls; Rudolf Meier; Christoph Sandrock; Martin Hauser4; Ljiljana Šašić Zorić; Elina Laiho; Andrea Aracil; Jovana Doderović; Rozane Badenhorst; Phira Unadirekkul; Nur Arina Binte Mohd Adom; Leo Wein; Cameron Richards; Jeffery K. Tomberlin; Santos Rojo; Sanja Veselić; Tuure Parviainen","1"
"Choirul, M; Nurhadi, M; Kusumawardani, R; Anisa, S; Yulian, SA; Rahma, SA; Akbar, M; Umar, AH; Guo, YB; Lai, SY","1"
"González-Tokman, D; Córdoba-Aguilar, A; Dáttilo, W; Lira-Noriega, A; Sánchez-Guillén, RA; Villalobos, F","1"
"Yaxin Pei, Sijie Zhao, Xiang Chen, Jiran Zhang, Hongyuhang Ni, Mengxiao Sun, Hui Lin, Xinyu Liu, Hongge Chen, Sen Yang","1"
"Matteo Brunetti, Giulia Magoga, Fabrizia Gionechetti, Alessio De Biase and Matteo Montagna","1"
"Sara Bellinvia, Paul R. Johnston, Susan Mbedi, and Oliver Otti","1"
"Giovanni Benelli; Angelo Canale; Alfio Raspi; Gino Fornaciari","1"
"Marleny Farcia-Lozano, Joshua Haynes, Carlos Lopez-Oritz, Purushothaman Natarajan, Yardira Pena-Garcia, Padma Nimmakayala, John Stommel, Suresh Alaparthi, Cristian Sibu, Nagamani Balagurusamy, Umesh Reddy","1"
"Hu, YJ; Huang, YH; Tang, T; Zhong, L; Chu, WY; Dai, ZY; Chen, KJ; Hu, Y","1"
"Goo, TW; Kim, SW; Yun, EY","1"
"Natuo Kômoto; Shuichiro Tomita","1"
"Oddon, SB; Biasato, I; Resconi, A; Gasco, L","1"
"Riddick, EW; Walker, RC; Rojas, MG; Morales-Ramos, JA","1"
"Sofie Delbare, Yasir Ahmed-Braimah, Mariana Wolfer, Andrew Clark","1"
"Ning Jin; Yanxia Liu; Shouyu Zhang; Shibo Sun; Minghuo Wu; Xiaoying Dong; Huiyan Tong; Jianqiang Xu; Hao Zhou; Shui Guan; Weiping Xu","1"
"Kolluru, GR; Zuk, M; Chappell, MA","1"
"Ihor S. Yurkevych; Lindsey J. Gray; Dmytro V. Gospodaryov; Nadia I. Burdylyuk; Kenneth B. Storey; Stephen J. Simpson; Oleh Lushchak","1"
"Philipp Engel, Waldan K. Kwong, Quinn McFrederick, Kirk E. Anderson, Seth Michael Barribeau, James Angus Chandler, R. Scott Cornman, Jacques Dainat, Joachim R. de Miranda, Vincent Doublet, Olivier Emery, Jay D. Evans, Laurent Farinelli, Michelle L. Flenniken, Fredrik Granberg, Juris A. Grasis, Laurent Gauthier, Juliette Hayer, Hauke Koch, Sarah Kocher, Vincent G. Martinson, Nancy Moran, Monica Munoz-Torres, Irene Newton, Robert J. Paxton, Eli Powell, Ben M. Sadd, Paul Schmid-Hempel, Regula Schmid-Hempel, Se Jin Song, Ryan S. Schwarz, Dennis vanEngelsdorp, Benjamin Dainatab","1"
"Zongqing Kou; Xingyu Luo; Yuguo Jiang; Bihui Chen; Yu Song; Yaohui Wang; Jun Xu; Jeffery K. Tomberlin; Yongping Huang","1"
"Ahmed, F; Pudda, F; Muzzeddu, M; Pedrini, A; Serra, G; Knoll, S; Morrone, S; Nery, J; Schiavone, A; Seidavi, A; Cappai, MG","1"
"Ryuda, M (Ryuda, Masasuke); Tsuzuki, S (Tsuzuki, Seiji); Matsumoto, H (Matsumoto, Hitoshi); Oda, Y (Oda, Yasunori); Tanimura, T (Tanimura, Teiichi); Hayakawa, Y (Hayakawa, Yoichi)","1"
"Meredith Blackwell","1"
"Radwan, MA; Maggiolino, A; Hassanien, HAM; Palo, PD; El-Kassas, NEM; Abbas, HS; Salem, AZM","1"
"Dilip K. Nag; Constentin Dieme; Pascal Lapierre; Erica Lasek-Nesselquist; Laura D. Kramer","1"
"Dong-Bin Chen; Run-Xi Xia; Qun Li; Yu-Ping Li; Hui-Ying Cao; Yan-Qun Liu","1"
"Cody J. Champion and Jiannong Xu","1"
"Xiaoyan Peng; Jiawen Liu; Baoling Li; Shengyin Wang; Bosheng Chen; Dayu Zhang","1"
"Tali S. Berman, Sivan Laviad-Shitrit, Maya Lalzar, Malka Halpern, Moshe Inbar","1"
"Meng Yue Wu; Giovanni Forcina; Gabriel Weijie Low; Keren R. Sadanandan; Chyi Yin Gwee; Hein van Grouw; Shaoyuan Wu; Scott V. Edwards; Maude W. Baldwin; Frank E. Rheindt","1"
"Seogwon Lee, Ju Yeong Kim, Myung-Hee Yi, In-Yong Lee, Dongeun Yong, Tai-Soon Yong","1"
"Katerina Nikolouli; Hervé Colinet; Christian Stauffer; Kostas Bourtzis","1"
"L. M. Beaver; B. L. Rush; B. O. Gvakharia; J. M. Giebultowicz","1"
"Fanny Eberhard, Sven Klimpel, Alessandra Fuarneri, Nicholas Tobias","1"
"Vasco Medici; Sibylle Chantal Vonesch; Steven N. Fry; Ernst Hafen","1"
"Crosbie, M; Zhu, CL; Shoveller, AK; Huber, LA","1"
"Huang JH, Jing X, Douglas AE","1"
"Valentine Chapelle; Frédéric Silvestre","1"
"Szczepanik, K; Swiatkiewicz, M","1"
"Laurence Auger, Sidki Bouslama, Marie-Helene Deschamps, Grant Vandenberg, Nicolas Derome","1"
"Gianluca Galassi, Costanza Jucker, Pietro Parma, Daniela Lupi, Gianni Matteo Crovetto, Sara Savoldelli, Stefania Colombini","1"
"D. Rodrı´guez-Go´mez, O. Loera; G. Saucedo-Castan˜eda; G. Viniegra-Gonza´lez","1"
"Soomro, AA; Cai, M; Laghari, ZA; Zheng, L; Rehman, KU; Xiao, X; Hu, S; Yu, Z; Zhang, J","1"
"Padmanabha, M; Kobelski, A; Hempel, AJ; Streif, S","1"
"Radhakrishnan, G; Silva, MS; Lock, EJ; Belghit, I; Philip, AJP","1"
"Julia Friman, Peter Karssemeijer, Julian Haller, Kris de Kreek, Joop van Loon, Marcel Dicke","1"
"Günther V, Lindert U, Schaffner W","1"
"Marion M. Lemoine, Tobias Engl, Martin Kaltenpoth","1"
"Thomas Klammsteiner, Andreas Walter, Tajda Bogataj, Carina Heussler, Blaz Stres, Florian Steiner, Birgit Schlick-Steiner, Wolfgang Arthofer, Heribert Insam","1"
"Liu, QL; Tomberlin, JK; Brady, JA; Sanford, MR; Yu, ZN","1"
"Haifei Hu; Armin Scheben; Jian Wang; Fangping Li; Chengdao Li; David Edwards; Junliang Zhao","1"
"Yoshitomo Kikuchi, Akiyo Tada, Dmitry L. Musolin, Nobuhiro Hari, Takahiro Hosokawa, Kenji Fujisaki, Takema Fukatsu","1"
"Lievens, S; Vervoort, E; Bruno, D; van der Donck, T; Tettamanti, G; Seo, JW; Poma, G; Covaci, A; De Smet, J; van der Borght, M","1"
"Oteri, M; Chiofalo, B; Di Rosa, AR","1"
"Shuai Zhan; Gangqi Fang; Minmin Cai; Zongqing Kou; Jun Xu1; Yanghui Cao; Liang Bai; Yixiang Zhang; Yongmao Jiang; Xingyu Luo; Jian Xu; Xia Xu; Longyu Zheng; Ziniu Yu; Hong Yang; Zhijian Zhang; Sibao Wang; Jeffery K. Tomberlin; Jibin Zhang; Yongping Huang","1"
"Yi-Ting Yang; Mi Rong Lee; Se Jin Lee; Sihyeon Kim; Yu-Shin Nai; Jae Su Kim","1"
"Daniel Garttling, Sascha M Kirchner, Hannes Schulz","1"
"Hideki Kagata, Takayuki Ohgushi","1"
"Bortolini, S; Macavei, LI; Saadoun, JH; Foca, G; Ulrici, A; Bernini, F; Malferrari, D; Setti, L; Ronga, D; Maistrello, L","1"
"Mauro Degli Esposti, Esperanza Martinez Romero","1"
"Jelle Boonekamp; Rolando Rodríguez-Muñoz; Paul Hopwood; Erica Zuidersma; Ellis Mulder; Alastair Wilson; Simon Verhulst; Tom Tregenza","1"
"Shi-Hong Gu; Pei-Ling Lin; Chia-Hao Chang","1"
"Borremans, A; Smets, R; Van Campenhout, L","1"
"James Rapkin; Kim Jensen; Clarissa M. House; Alastair J. Wilson; John Hunt","1"
"Czekala, W; Janczak, D; Cieslik, M; Mazurkiewicz, J; Pulka, J","1"
"Vieira, AS; Bueno, OC","1"
"Barrett, M; Chia, SY; Fischer, B; Tomberlin, JK","1"
"Ying Gong; Yefang Li; Xuexue Liu; Yuehui Ma; Lin Jiang","1"
"Tobin J. Hammer, Daniel H. Janzen, Winnie Hallwachs, Samuel P. Jaffe, Noah Fierer","1"
"Kahraman, O; Gulsen, N; Inal, F; Alatas, MS; Inanc, ZS; Ahmed, I; Sisman, D; Kucuek, AE","1"
"Xiao-Ming Liu; Bang-Xian Zhang; Shi-Guang Li; Xiang-Jun Rao; Dong-Ming Wang; Xiao-Xuan Hu; Su Liu","1"
"Zavala, JA; Nabity, PD; DeLucia, EH","1"
"Kelvin L. Hull; Matthew P. Greenwood; Melissa Lloyd; Aletta E. Bester-van der Merwe; Clint Rhode","1"
"Kees van Oers; Krista van den Heuve; Bernice Sepers","1"
"Luca Borrelli, Lorena Coretti, Ludovico Dipineto, Fulvia Bovera, Francesca Menna, Lorenzo Chiariotti, Antonio Nizza, Francesca Lembo & Alessandro Fioretti","1"
"Helson, JE; Capson, TL; Windsor, DM","1"
"Yakti, Wael; Mueller, Marcus; Klost, Martina; Mewis, Inga; Dannehl, Dennis; Ulrichs, Christian","1"
"Ewen Burban; Maud I Tenaillon; Arnaud Le Rouzic","1"
"Stastnik, O; Novotny, J; Roztocilova, A; Kouril, P; Kumbar, V; Cernik, J; Kalhotka, L; Pavlata, L; Lacina, L; Mrkvicova, E","1"
"Sarah L. Amundrud; Diane S. Srivastava","1"
"Peng, K; Mo, W; Xiao, H; Hu, J; Zhu, X; Huang, Y; Wang, G","1"
"Addeo, NF; Scivicco, M; Vozzo, S; Bovera, F; Asiry, KA; Alqurashi, S; Cacciola, NA; Severino, L","1"
"G.-M. Shen; W. Dou; Y. Huang; X.-Z. Jiang; G. Smagghe and J.-J. Wang","1"
"Prosper Habineza, Abrar Muihammad, Tianliang Ji, Rong Xiae, Xianyunan Yin, Youming Hou, Zhanghong Shi","1"
"Shiehzadegan, S; Thuy, JLV; Szabla, N; Angilletta, MJ; VandenBrooks, JM","1"
"De Filippis, F; Bonelli, M; Bruno, D; Sequino, G; Montali, A; Reguzzoni, M; Pasolli, E; Savy, D; Cangemi, S; Cozzolino, V; Tettamanti, G; Ercolini, D; Casartelli, M; Caccia, S","1"
"Emilia Kooienga, Courtney Baugher, Morgan Currin, Jeffery Tomberlin, and Heather Jordan","1"
"Wenchao Tang; Yuanyuan Xiao; Guannan Li; Xi Zheng; Yaru Yin; Lingyan Wang; Yong Zhu","1"
"Opare, LO; Meister, H; Holm, S; Kaasik, A; Esperk T","1"
"Ng, WK; Liew, FL; Ang, LP; Wong, KW","1"
"Reguzzi, MC; Cominelli, F; Bardone, M; Aldini, RN; Chiesa, O; Panini, M; Casu, G; Mazzoni, E","1"
"Sayed, WAA; Alm-Eldin, MMS; Hassan, RS; Sileem, TM; Rumpold, BA","1"
"Md Reaz Chaklader, Janet Howieson, Md Javed Foysal, Ravi Fotedar","1"
"Silvia F. Zanini; Philipp E. Bayer; Rachel Wells; Rod J. Snowdon; Jacqueline Batley; Rajeev K. Varshney; Henry T. Nguyen; David Edwards; Agnieszka A. Golicz","1"
"Kane A Lawhorn; Stephen P Yanoviak","1"
"Cintia Cansado-Utrilla, Serena Y. Zhao, Philip J. McCall, Kerri L. Coon, Grant L. Hughes","1"
"Alejandra Carla Scannapieco; Claudia Alejandra Conte; Máximo Rivarola; Juan Pedro Wulff; Irina Muntaabski; Andrés Ribone; Fabián Milla; Jorge Luis Cladera; Silvia Beatriz Lanzavecchia","1"
"Mat, K; Kari, ZA; Rusli, ND; Rahman, MM; Harun, HC; Al-Amsyar, SM; Nor, MFM; Dawood, MAO; Hassan, AM","1"
"Alex Arp, Gladys Quintero, Agustin Sagel, Rafael Gonzales Batista, Pamela Phillips, Paul Hickner","1"
"Nguyen, TTX; Tomberlin, JK; Vanlaerhoven, S","1"
"Wei, Y; Xue, LF; Ma, DY; Weng, YX; Liu, MK; Li, LY; Dai, ZY; Zhao, ZY; Wang, HF; Xu, X","1"
"Yong Cui; Zu-Lian Liu; Cen-Cen Li; Xiang-Min Wei; Yong-Jian Lin; Lang You; Zi-Dan Zhu; Hui-Min Deng; Qi-Li Feng; Yong-Ping Huang; Hui Xiang","1"
"Alton, LA; Kutz, TC; Bywater, CL; Beaman, JE; Arnold, PA; Mirth, CK; Sgrò, CM; White, CR","1"
"Queiroz, LS; Regnard, M; Jessen, F; Mohammadifar, MA; Sloth, JJ ; Petersen, HO; Ajalloueian, F; Brouzes, CMC; Fraihi, W; Fallquist, H; de Carvalho, AF; Casanova, F","1"
"C. Rhode; R. Badenhorst; K. L. Hulll; M. P. Greenwood; A. E. Bester-van der Merwe; A. A. Andere; C. J. Picard; C. Richards","1"
"Madibana, MJ; Mwanza, M; Lewis, BR; Fouche, CH; Toefy, R; Mlambo, V","1"
"Ana Carolina M. Junqueira, Aakrosh Ratan, Enzo Acerbi, Daniela I. Drautz-Moses, Balakrishnan N. V. Premkrishnan, Paul I. Costea, Bodo Linz, Rikky W. Purbojati, Daniel F. Paulo, Nicolas E. Gaultier, Poorani Subramanian, Nur A. Hasan, Rita R. Colwell, Peer Bork, Ana Maria L. Azeredo-Espin, Donald A. Bryant, Stephan C. Schuster","1"
"Arunaa Kali","1"
"Hu, CX; Yang, LY; Wang, HL; Xiao, XP; Wang, ZW; Gong, XY; Liu, XL; Li, W","1"
"Matsakidou, A; Sarivasiliou, SI; Pissia, MA; Rumbos, CI; Athanassiou, CG; Paraskevopoulou, A","1"
"Coudron, CL; Deruytter, D; Claeys, J","1"
"Brenda Oppert; Lindsey C. Perkin; Marcé Lorenzen; Aaron T. Dossey","1"
"Marin, ALM; Gariglio, M; Pozzo, S; Capucchio, MT; Ferrocino, I; Biasato, I; Schiavone, A","1"
"Zhao, Junliang; Ban, Takuma; Miyawaki, Hironori; Hirayasu, Hirofumi; Izumo, Akihisa; Iwase, Shun-ichiro; Kasai, Koji; Kawasaki, Kiyonori","1"
"Muslimin, Boby; Yonarta, Danang; Heriyati, Eny; Helmizuryani, Helmizuryani; Sari, Meika Puspita; Apriyanti, Dewi; Kurniawan, Rahmat","1"
"Takaomi Sakai; Toshihiro Kitamoto","1"
"Andrea Osimani, Vesna Milanovic, Frederica Cardinali, Cristiana Garofalo, Francessca Clementi, Sara Ruschioni, Paola Riolo, Nunzio Isidora, Nino Loreto, Roberta Galarini, Simone Moretti, Annalisa Petruzzelli, Elonora Micci, Franco Tonucci, Lucia Aquilanti","1"
"Armién, AG; Polon, R; Crossley, BM","1"
"Elise Didion, Zakee Sabree, Laura Kenyon, Gabriela Nine, Richard Hagan, Sema Osman, Joshua Benoit","1"
"Ravi, HK; Degrou, A; Costil, JM; Trespeuch, C; Chemat, F; Vian, MA","1"
"Wanqiang Wang; Wenzheng Tang; Xiaoping Wang; Wen Liu; Fen Zhu","1"
"Salahuddin, M; Abdel-Wareth, AAA; Hiramatsu, K; Tomberlin, JK; Luza, D; Lohakare, J","1"
"Evalyne W. Ndotono, Fathiya M. Khamis, Joel L. Bargul, and Chrysantus M. Tanga","1"
"Yudong Zheng; Cuihong Hou; Jian Chen; Hongming Wang; Hang Yuan; Naijie Hu; Lili Shi; Shuang Zhang","1"
"Heuel, M; Kreuzer, M; Gangnat, IDM; Frossard, E; Zurbrügg, C; Egger, J; Dortmans, B; Gold, M; Mathys, A ; Jaster-Keller, J; Weigel, S; Sandrock, C; Terranova, M","1"
"Schiavone, A; Castillo, A","1"
"Tohir A Bozorov, Bakhtiyor A Rasulov, Daoyuan Zhang","1"
"Osimani, Andrea ; Milanovic, V (Milanovic, Vesna); Cardinali, F (Cardinali, Federica); Garofalo, C (Garofalo, Cristiana); Clementi, F (Clementi, Francesca); Ruschioni, S (Ruschioni, Sara) ; Riolo, P (Riolo, Paola) ; Isidoro, N (Isidoro, Nunzio); Loreto, N (Loreto, Nino); Galarini, R (Galarini, Roberta) ; Moretti, S (Moretti, Simone) ; Petruzzelli, A (Petruzzelli, Annalisa); Micci, E (Micci, Eleonora); Tonucci, F (Tonucci, Franco); Aquilanti, L (Aquilanti, Lucia)","1"
"Joel G. Kingsolver; Heidi J. MacLean; Silvan B. Goddin; Kate E. Augustine","1"
"Matteo Callegari, Elena Crotti, Marco Fusi, Ramona Marasco, Elena Gonella, Ivano De Noni, Diego Romano, Sara Borin, George Tsiamis, Ameur Cherif, Alberto Alma, and Daniele Daffonchio.","1"
"Shou-Min Fang; Qiu-Zhong Zhou; Quan-You Yu; Ze Zhang.","1"
"Md Javed Foysal, Ravi Fotedar, Muhammad A.B. Siddik, Md Reaz Chaklader, Alfred Tay","1"
"Lavinia Iancu, corresponding author, Emily N Junkins, Georgiana Necula-Petrareanu, Cristina Purcarea","1"
"MARCO V. G. TORRIANI; DOMINIQUE MAZZI; SILKE HEIN; SILVIA DORN","1"
"Kim F. Rewitza; Michael B. O’Connorb; Lawrence I. Gilbert","1"
"Sankappa, NM; Lange, MD; Yildirim-Aksoy, M; Eljack, R; Kucuktas, H; Beck, BH; Abernathy, JW","1"
"Charles J. Mason, Kelli Hoover, Gary W. Felton","1"
"Bulak, P; Proc-Pietrycha, K; Kaczor, M; Zlotko, K; Polakowski, C; Wiacek, D; Waniak-Nowicka, H; Zieba, E; Wasko, A; Oleszczuk, P; Bieganowski, A","1"
"Heuel, M; Sandrock, C; Leiber, F; Mathys, A; Gold, M; Zurbrugg, C; Gangnat, IDM; Kreuzer, M; Terranova, M","1"
"Rasalkar Sandhya Yashwant; Dyna Susan Thomas; Chitra Manoharan; Upendra Nongthomba; Vankadara Sivaprasad; Ravikumar Gopalapillai","1"
"Neupane, S; Hall, B; Brooke, G; Nayduch, D","1"
"Chuan-Zhen Qiu; Qiu-Zhong Zhou; Ting-Ting Liu; Shou-Min Fang; Ya-Wang Wang; Xin Fang; Chun-Li Huang; Quan-You Yu; Chun-Hong Chen; Ze Zhang","1"
"Hao Tong; Anika Küken; Zoran Nikolosk","1"
"Bjorge, JD; Overgaard, J; Malte, H; Gianotten, N; Heckmann, LH ","1"
"Bridget C Griffith, Brian L Weiss, Emre Aksoy, Paul O Mireji, Joana E Auma, Florence N Wamwiri, Richard Echodu, Grace Murilla, and Serap Aksoy","1"
"James Doonan, Martin Broberg, Sandra Denman, James McDonald","1"
"Elahi, U; Wang, J; Ma, YB; Wu, SG; Wu, JL; Qi, GH; Zhang, HJ","1"
"Shenmin Kang, Yujie Meng, Xiaomeng Cheng, Junhong Tu, Du Guo, Yunfeng Xu, Sen Liang, Xiaodong Xia, Chao Shi1","1"
"Mei Luo, Cédric Finet, Haosu Cong, Hong-yi Wei and Henry Chung","1"
"Ospina-Granobles, K; Carrejo-Gironza, N","1"
"Daniele Bruno, Marco Bonelli, Francesca De Filippis, Ilaria Di Lelio, Gianluca Tettamanti, Morena Casartelli, Danilo Ercolini, Silvia Caccia","1"
"Crosbie, M; Zhu, CL; Karrow, NA; Huber, LA","1"
"Mannucci, A; Panariello, L; Abenaim, L; Coltelli, MB; Ranieri, A; Conti, B; Santin, M; Castagna, A","1"
"Hogsette, JA","1"
"Ting-ting Chen; Li-rong Tan; Nan Hu; Zhan-qi Dong; Zhi-gang Hu; Ya-ming Jiang; Peng Chen; Min-hui Pan; Cheng Lu ","1"
"Muhammad Azeem, Gunaratna Kuttuva Rajarao, Henrik Nordenhem, Goran Nordlander Anna Karin Borg-Karlson","1"
"Pornsuwan, R; Pootthachaya, P; Bunchalee, P; Hanboonsong, Y; Cherdthong, A; Tengjaroenkul, B; Boonkum, W; Wongtangtintharn, S","1"
"Pornanong Aramwit; Qiuran Jiang; Supritha Muppuri; Narendra Reddy.","1"
"W. K. Tonui; V. Ahuja; C. J. Beech; J. B. Connolly; B. Dass; D. C. M. Glandorf; S. James; J. N. Muchiri; C. F. Mugoya; E. A. Okoree; H. Quemada; J. Romeis","1"
"Sonomi Minagawa; Jun-ichi Hikima; Ikuo Hirono; Takashi Aoki; Hajime Mori","1"
"Bryony C Bonning","1"
"Hakenasen, IM; Grepperud, GH; Hansen, JO; Overland, M ; Anestad, RM ; Mydland, LT","1"
"Kepinska-Pacelik, J; Biel, W; Podsiadlo, C; Tokarczyk, G; Biernacka, P; Bienkiewicz, G","1"
"Li, XC; Dong, YW; Sun, QX; Tan, XH; You, CH; Huang, YH; Zhou, M","1"
"Gabriela M. Quinlan; Cody Feuerborn; Heather M. Hines; Christina M. Grozinger","1"
"David Renault; P. Vernon; G. Vannier","1"
"Meneguz, M; Gasco, L; Tomberlin, JK","1"
"Jiasheng Song; Shutang Zhou","1"
"Ann-Christin Honnen; Paul R. Johnston; Michael T. Monaghan","1"
"Xuan Deng; Lianlian Liu; Jing Deng; Xingfu Zha","1"
"Qiu, JF; Luo, C; Ren, LH; Li, W; Dai, TM; Wang, G; Sun, XN; Moua, KCC; Sima, YH; Xu, SQ","1"
"Brenda Oppert; Fu-Chyun Chu; Steven Reyna; Sofia Pinzi; Sherry Adrianos; Lindsey Perkin; Marcé Lorenzen","1"
"Md Javed Fosal, Thi Thanh Thuy Dao, Ravi Fotedar, Sanjay Kumar Gupta, Alfred Tay, Md Reaz Chaklader","1"
"Hahn, T; Tafi, E; von Seggern, N; Falabella, P; Salvia, R; Thomä, J; Febel, E; Fijalkowska, M","1"
"David Huyben; Aleksandar Vidaković; Sofia Werner Hallgren; Markus Langeland","1"
"Xiaoling Tong; Min-Jin Han; Kunpeng Lu; Shuaishuai Tai; Shubo Liang; Yucheng Liu; Hai Hu; Jianghong Shen; Anxing Long; Chengyu Zhan; Xin Ding; Shuo Liu; Qiang Gao; Bili Zhang; Linli Zhou; Duan Tan; Yajie Yuan; Nangkuo Guo; Yan-Hong Li; Zhangyan Wu; Lulu Liu; Chunlin Li; Yaru Lu; Tingting Gai; Yahui Zhang; Renkui Yang; Heying Qian; Yanqun Liu; Jiangwen Luo; Lu Zheng; Jinghou Lou; Yunwu Peng; Weidong Zuo; Jiangbo Song; Songzhen He; Songyuan Wu; Yunlong Zou; Lei Zhou; Lan Cheng; Yuxia Tang; Guotao Cheng; Lianwei Yuan; Weiming He; Jiabao Xu; Tao Fu; Yang Xiao; Ting Lei; Anying Xu; Ye Yin; Jian Wang; Antónia Monteiro; Eric Westhof; Cheng Lu; Zhixi Tian; Wen Wang; Zhonghuai Xiang; and Fangyin Dai.","1"
"Jo-anne C. Holley, Mary N. Jackson, Anna T. Pham, Sarah C. Hatcher, Nancy A. Moran","1"
"Rui Xiao; Yi Yuan; Hengchuan Xia; Qi Ge; Liang Chen; Feifei Zhu; Jia Xu; Xueqi Wang; Yixuan Fan; Qiang Wang; Yanhua Yang; Keping Chen","1"
"Yanxian Li, Leonardo Bruni, Alexander Jaramillo-Torres, Karina Gajardo, Trond M Kortner, Ashild Krogdahl","1"
"Bawa, M; Songsermpong, S; Kaewtapee, C; Chanput, W","1"
"Van Peer, M; Frooninckx, L; Coudron, C; Berrens, S; Alvarez, C ; Deruytter, D; Verheyen, G; Van Miert, S","1"
"Marc G Chevrette, Caitlin M Carlson, Humberto E Ortega, Chris Thomas, Gene E Ananiev, Kenneth J Barns, Adam J Book, Julian Cagnazzo, Camila Carlos, Will Flanigan, Kirk J Grubbs, Heidi A Horn, F Michael Hoffmann, Jonathan L Klassen, Jennifer J Knack, Gina R Lewin, Bradon R McDonald, Laura Muller, Weilan G P Melo, Adrián A Pinto-Tomás, Amber Schmitz, Evelyn Wendt-Pienkowski, Scott Wildman, Miao Zhao, Fan Zhang, Tim S Bugni, David R Andes, Monica T Pupo, Cameron R Currie","1"
"Frederik Post; Erich Bornberg-Bauer; Mireille Vasseur-Cognet; Mark C. Harrison","1"
"Sumit Kumar Aggarwal; Alla Singh; Mukesh Choudhary; Aundy Kumar; Sujay Rakshit; Pardeep Kumar; Abhishek Bohra; Rajeev K. Varshney","1"
"Natapong Jupatanakul, Shuzhen Sim, George Dimopoulos","1"
"Mahmood, S; Ali, A; Zurbrügg, C; Dortmans, B; Asmara, DR","1"
"Andrés Mesas; Angélica Jaramillo; Luis E. Castañeda","1"
"Robert F. Mitchell, Lawrence M. Hanks","1"
"Juan A. Morales-Ramos; M. Guadalupe Rojas; Damian Tweedy; Virginia Emery; Hans C. Kelstrup","1"
"Scott A. Keith","1"
"Iona Cunningham-Eurich; Danai Kontou; Monika Yordanova; Alejandro Maeda-Obregon; Emeline Favreau; Jinliang Wang; Adam G Hart; Seirian Sumner","1"
"Ya-Nan Zhu; Li-Zhi Wang; Cen-Cen Li; Yong Cui; Man Wang; Yong-Jian Lin; Ruo-Ping Zhao; Wen Wang; Hui Xiang","1"
"Angeliki Paspati; Kim B. Ferguson; Eveline C. Verhulst; Alberto Urbaneja; Joel Gonzalez-Cabrera; Bart A. Pannebakker","1"
"Javier A. Ceja-Navarro, Fernando E. Vega, Ulas Karaoz, Zhao Hao, Stefan Jenkins, Hsiao Chien Lim, Petr Kosina, Francisco Infante, Trent R. Northen, Eoin L. Brodie","1"
"Rivas-Navia, DM; Dueñas-Rivadeneira, AA; Dueñas-Rivadeneira, JP; Aransiola, SA; Maddela, NR; Prasad, R","1"
"Bosch, G; Swanson, KS","1"
"Yanxian Li, Karina Gajardo, Alexander Jaramillo-Torres, Trond M Kortner, Ashild Krogdahl","1"
"Dongmei Jiang, Kunhong Jiang, Rui Li, Liangbin Zhao, Zile Liu, Bangjie Xiong, Du Jin, Xiaoxia Hao, Li Zhu, Bo Kang & Lin Bai","1"
"Seogwon Lee, Ju Yeong Kim, Myung-hee Yi, In-Yong Lee, Won-Ja Lee, Hye Su Moon, Dongeun Yong, Tai-Soon Yong","1"
"Kirimi, James; Riungu, Joy N. N.; Kiogora, Domenic; Marete, Eunice N. N.; Kagendo, Dorothy; Dey, Prasanta","1"
"Rebecca B. Corley; Will Dawson; Tom R. Bishop","1"
"Xiaobang Hu; Matthew T. Leming; Michelle A. Whaley; Joseph E. O'Tousa","1"
"Z. Mikołajczak, M. Rawski, J. Mazurkiewicz, B. Kieron´czyk, P. Kołodziejski, E. Pruszyn´ska-Oszmałek, D. Józefiak","1"
"Laird-Hopkins, BC; Ashe-Jepson, E; Basset, Y; Cobo, SA; Eberhardt, L; Freiberga, I; Hellon, J; Hitchcock, GE; Kleckova, I; Linke, D; Lamarre, GPA; McFarlane, A; Savage, AF; Turner, EC; Zamora, AC; Sam, K; Bladon, AJ","1"
