"authors","paper_count"
"Ahmad, IK; Peng, NT; Amrul, NF; Basri, NEA ; Jalil, NAA; Azman, NA","1"
"Bordiean, A; Krzyzaniak, M; Stolarski, MJ; Peni, D","1"
"Ali, B., Zhou, Y., Zhang, Q., Niu, C., & Zhu, Z.","1"
"Orkusz, A; Dyminska, L; Banas, K; Harasym, J","1"
"Parodi, A; Van Dijk, K; Van Loon, JJA; De Boer, IJM; Van Schelt, J; Van Zanten, HHE","1"
"Juliana M. Ruiz Barrionuevo","1"
"Cai, R., Wu, X., Wang, X., & Xu, X.","1"
"Ary A. Hoffmann; Perran A. Ross","1"
"Sajid, QU; Asghar, MU; Tariq, H; Wilk, M; Platek, A","1"
"Regel, R (Regel, R) ; Matioli, SR (Matioli, SR) ; Terra, WR (Terra, WR)","1"
"Danielle N.A. Lesperance, Nichole A. Broderick","1"
"L R Shapiro, I Seidl-Adams, C M De Moraes, A G Stephenson, M C Mescher","1"
"Kane J. Yoon1; Christopher B. Cunningham2; Amanda Bretman1; Elizabeth J. Duncan","1"
"Mouithys-Mickalad, A; Schmitt, E; Dalim, M; Franck, T; Tome, NM; van Spankeren, M; Serteyn, D; Paul, A","1"
"Qiuying Chen; Xi Yang; Dongrui You; Jiaojiao Luo; Xiaojing Hu; Zhifeng Xu; Wei Xiao","1"
"Biancarosa, I; Sele, V; Belghit, I; Ornsrud, R; Lock, EJ; Amlund, H","1"
"Eduardo Almeida, Celine Ribiere, Werner Frei, Denis Kenny, Mary Coffey, Paul O'Toole","1"
"Dennis Beesigamukama, Sevgan Subramanian, Chrysantus M. Tanga","1"
"Zhao-Zhe Xin,† Qiu-Ning Liu,*,† Yu Liu, Dai-Zhen Zhang, Zheng-Fei Wang, Hua-Bin Zhang, Bao-Ming Ge, Chun-Lin Zhou, Xin-Yue Chai, and Bo-Ping Tang","1"
"Jason W Millington; George P Brownrigg; Charlotte Chao; Ziwei Sun; Paige J Basner-Collins; Lianna W Wat; Bruno Hudry; Irene Miguel-Aliaga; Elizabeth J Rideout","1"
"Thomas Klammsteiner, Andreas Walter, Tajda Bogataj, Carina Heussler, Blaz Stres, Florian Steiner, Birgit Schlick-Steiner, Heribert Insam","1"
"Fayed, WM; Mansour, AT; Zaki, MA; Omar, EA; Nour, AAM; Taha, EM; Sallam, GR","1"
"Matan Shelomi, Ming-Ju Chen","1"
"R. Lubart, A. Lipovski, Y. Nitzan, H. Friedmann","1"
"Sarah Chérasse; Boris Baer; Morten Schiøtt; Jacobus J. Boomsma","1"
"Md Javed Foysal, Ravi Fotedar, Chin-Yen Tay, Sanjay Kumar Gupta","1"
"Erik. T. Frank; Lucie Kesner; Joanito Liberti; Quentin Helleu; Adria C. LeBoeuf; Andrei Dascalu; Douglas B. Sponsler; Fumika Azuma; Evan P. Economo; Patrice Waridel; Philipp Engel; Thomas Schmitt; Laurent Keller ","1"
"Lanes, CFC; Pedron, FA; Bergamin, GT; Bitencourt, AL; Dorneles, BER; Villanova, JCV; Dias, KC; Riolo, K; Oliva, S; Savastano, D; Giannetto, A","1"
"Scharlaken, B; de Graaf, DC; Goossens, K; Brunain, M; Peelman, LJ; Jacobs, FJ","1"
"Minmin Cai; Li Li; Zhengzheng Zhao; Ke Zhang; Fang Li; Chan Yu; Rongfang Yuan; Beihai Zhou; Zhuqing Ren; Ziniu Yu 1; Jibin Zhang","1"
"Devin Arbuthnott, Tera Levin, Daneil Promislow","1"
"Elsi Hietaranta, Heli Juottonen, Minna-Maarit Kytöviita","1"
"Jianhai Chen; Pan Ni; Xinyun Li; Jianlin Han; Ivan Jakovlic; Chengjun Zhang; Shuhong Zhao","1"
"Mamai, W; Lobb, LN; Somda, NSB; Maiga, H; Yamada, H; Lees, RS; Bouyer, J; Gilles, JRL","1"
"David Kang, Angela E. Douglas","1"
"Silvia Coolen, Magda Rogowska-van der Molen, Cornelia U Welte","1"
"Mahfooz, NS; Li, H; Popadic, A","1"
"Käfer, H; Kovac, H; Simov, N; Battisti, A; Erregger, B; Schmidt, AKD; Stabentheiner, A","1"
"Wouter Hendrycks, Hélène Delatte, Laura Moquet, Kostas Bourtzis, Nele Mullens, Marc De Meyer, Thierry Backeljau, Massimiliano Virgilio","1"
"Kamala Jayanthi Pagadala Damodaram; Vivek Kempraj; Ravindra Mahadappa Aurade; Sowmya Bandhisara Rajasekhar; Ravindra Kothapalli Venkataramanappa; Bakthavatsalam Nandagopal; Abraham Verghese","1"
"L. Sirot; R. Bansal; C. J. Esquivel; M. Arteaga-Vázquez; M. Herrera-Cruz; V. A. C. Pavinato; S. Abraham; K. Medina-Jiménez; M. Reyes-Hernández; A. Dorantes-Acosta; D. Pérez-Staples","1"
"Sushil K. Gaire; Saluna Pokhrel; Md Jamil Hossain Biswas; Bishwo P. Mainali; Vivian Mendez; Jeanneth Pérez; Phillip W. Taylor; Polychronis Rempoulakis.","1"
"Dingpei Long; Rongpeng Liu; Yang Huang; Anyao Fu; Yuli Zhang; Zhanzhang Hao; Qiang Li; Hanfu Xu; Zhonghuai Xiang; Aichun Zhao","1"
"Phillip Donkersley, Annabel Rice, Robert Graham, Kenneth Wilson","1"
"Jing, TZ; Qi, FH; Wang, ZY","1"
"Freel, TA; McComb, A; Koutsos, EA","1"
"Rolando Rodríguez-Muñoz; Paul Hopwood; Jelle J. Boonekamp; Stanley A. Edwards; Tom W. Price; Jasper Rees; Tom Tregenza.","1"
"Kotsou, K; Rumbos, CI; Baliota, GV; Gourgouta, M; Athanassiou, CG","1"
"Marco Bonelli; Daniele Bruno; Matteo Brilli; Novella Gianfranceschi; Ling Tian; Gianluca Tettamanti ; Silvia Caccia 6; Morena Casartelli","1"
"Rita de Cassia Pessotti, Bridget L Hansen, Jewel N Reaso, Javier A Ceja-Navarro, Laila El-Hifnawi, Eoin L Brodi, Mathew F. Traxler","1"
"O. Franz; T, Roder; M. Gewecke","1"
"Patrick Kluber, Stephanie Muller, Jonas Schmidt, Holger Zorn, Martin Ruhl","1"
"Dobermann, D; Field, LM; Michaelson, LV","1"
"Grisendi, A; Defilippo, F; Lucchetti, C; Listorti, V; Ottoboni, M; Dottori, M ; Serraino, A; Pinotti, L; Bonilauri, P","1"
"Graham A. McCulloch; Jonathan M. Waters","1"
"Jigyasa Arora, Yukihiro Kinjo, Jan Sobotnik, Ales Bucek, Crystal Clitheroe, Petr Stiblik, Yves Roisin, Lucia Zifcakova, Yung Chul Park, Ki Yoon Kim davil Sillam Dusses, Vincent Herve, Nathan Lo, Gaku Tokuda, Andreas Brune Thomas Bourguignon","1"
"Zhenghui Gao; Wenhui Deng; Fen Zhu","1"
"Sumbule, EK; Ambula, MK; Osuga, IM; Changeh, JG; Mwangi, DM; Subramanian, S; Salifu, D; Alaru, PAO; Githinji, M; van Loon, JJA; Dicke, M; Tanga, CM","1"
"Michał Kolasa, Radosław Ścibior, Miłosz A. Mazur, Daniel Kubisz, Katarzyna Dudek, Łukasz Kajtoch","1"
"Gariglio, M; Dabbou, S; Crispo, M; Biasato, I; Gai, F; Gasco, L; Piacente, F; Odetti, P; Bergagna, S; Placha, I; Valle, E; Colombino, E; Capucchio, MT; Schiavone, A","1"
"Fabiane Chaves Cançado; Amanda Abdalla Valério; Sandro Roberto Marana; João Alexandre Ribeiro Gonçalves Barbosa ","1"
"Van Looveren, N; Verbaet, L; Frooninckx, L; Van Miert, S; Van Campenhout, L; Borght, MV; Vandeweyer, D","1"
"Inusa Ajene , Fathiya Khamis, Barbara van Asch, Gerhard Pietersen, Brenda Rasowo, Fidelis Ombura, Anne Wairimu, Komivi Akutse, Mamoudou Setamou, Samira Mohamed, Sunday Ekesi","1"
"Kepinska-Pacelik, J; Biel, W","1"
"Erin D. Scully, Scott M. Geib, Charles J. Mason, John E. Carlson, Ming Tien, Han-Yi Chen, Scott Harding, Chung-Jui Tsai, Kelli Hoover","1"
"Joel Ljunggren, Felipe Borrero-Echeverry, Amrita Chakraborty, Tobias Lindblom, Erik Henderstrom, Maria Karlsson, Peter Witzgall, Marie Bengtsson","1"
"Sevasti Maistrou; Veronique Paris; Annette B. Jensen; Jens Rolff; Nicolai V. Meyling; Caroline Zanchi","1"
"Xi Zheng; Fengdan Liu; Min Shi; Shuo Li; Xiaofan Xie; Guannan Li; Xiaoning Zhang; Yong Zhu","1"
"Shahbuddin, D; Othman, A; Khair, ABA","1"
"Yuxia Cui, Sandra J McBride, Windy A Boyd, Scott Alper, Jonathan H Freedman","1"
"Kisaakye, J; Beesigamukama, D; Haukeland, S; Subramanian, S; Thiongo, PK; Kelemu, S; Tanga, CM","1"
"Hui Xiang; Xin Li; Fangyin Dai; Xun Xu; Anjiang Tan; Lei Chen; Guojie Zhang; Yun Ding; Qiye Li; Jinmin Lian; Andrew Willden; Qiuhong Guo; Qingyou Xia; Jun Wang; Wen Wang","1"
"Labella, R; Bochicchio, R; Addesso, R; Labella, D; Franco, A; Falabella, P; Amato, M","1"
"Tegtmeier, D; Hurka, S; Vilcinskas, A","1"
"Jessica Dittmer, Robert Brucker","1"
"Liu, CQ; Masri, J; Perez, V; Maya, C; Zhao, J","1"
"Astuti, DA; Wiryawan, KG","1"
"Yu Lou, Yiran Li , Baiyun Lu, Qiang Liu, Shan-Shan Yang, Bingfeng Liu, Nanqi Ren, Wei-Min Wu, Defeng Xing","1"
"K. J. Burls; J. Shapiro; M. L. Forister; G. A. Hoelzer","1"
"Anne M. Estes, David J. Hearn, Emilie C. Snell-Rood, Michele Feindler, Karla Feeser, Tselotie Abebe, Julie C. Dunning Hotopp, Armin P. Moczek","1"
"Wamai, LK; Munga, LM; Osuga, IM; Munguti, JM; Subramanian, S; Kidoido, MK; Ghemoh, JC; Mwendia, CM; Tanga, CM; Liu, YQ","1"
"Tobin J. Hammer, August Easton-Calabria, Nancy A. Moran","1"
"Montevecchi, G; Macavei, LI; Zanelli, E; Benassi, G; Pinotti, G; D'Arco, S; Buffagni, S; Masino, F; Maistrello, L; Antonelli, A","1"
"Auger, L; Deschamps, MH; Vandenberg, G; Derome, N","1"
"D. Patrick Gainey; Jeremiah Y. Kim; Luana S. Maroja","1"
"Nicholls, E; Rossi, M; Niven, JE","1"
"Waqas Wakil, Muhammad Tahir, Abdullah M Al-Sadi, David Shapiro-Ilan","1"
"Thomas Bourguignon, Nathan Lo, Carsten Dietrich, Jan Šobotník, Sarah Sidek, Yves Roisin, Andreas Brune, Theodore A Evans","1"
"A. Lecocq; A.S. Olesen; C.M. Lazov; S.M. Rajiuddin; A.B. Jensen; L. Lohse; T.B. Rasmussen; G.J. Belsham; A. Bøtner","1"
"Permatahati, D; Mutia, R; Astuti, DA","1"
"Sofija Pavković-Lučić; Jelena Trajković; Dragana Miličić; Boban Anđelković; Luka Lučić; Tatjana Savić; Ljubodrag Vujisić","1"
"Sinansari, S; Fahmi, MR","1"
"Tohir A. Bozorov, Zokir O. Toshmatov, Gulnaz Kahar, Daoyuan Zhang, Hua Shao, Yusufjon Gafforov","1"
"Bocheng Huang, Shuang, Zhang, Xiaohui Dong, Shuyan Chi, Qihui Yang,Hongyu Li, Beiping Tan, Shiqei Xie","1"
"Ye, B; Li, J; Xu, LJ; Liu, H; Yang, MJ","1"
"Juan Guzman, Andreas Vilcinskas","1"
"Denyse Cavalcante Lago; Martin Hasselmann; Klaus Hartfelder","1"
"Yuwono, AS; Permana, IG; Nurulalia, L; Mentari, PD","1"
"Xu Yang; Xiaoqian Zhang; Yujia Liu; Dehong Yang; Zulian Liu; Kai Chen; Linmeng Tang; Manli Wang; Zhihong Hu; Shengxiang Zhang; Yongping Huang","1"
"Parker, AL; Kingsolver, JG","1"
"Chengcheng Li; Lixiang Wang; Jiale Li; Chenglong Gao; Youqing Luo; Lili Ren","1"
"Wang Yiwen, Tian Xiaohan, Zhu Chunfeng, Yu Xiaoyu, Miao Yaodong, Qiao Huanhuan","1"
"Alessia Giannetto; Sabrina Oliva; Lorenzo Mazza; Giovanni Mondello; Domenico Savastano; Angela Mauceri; Salvatore Fasulo","1"
"Lu, SY; Taethaisong, N; Meethip, W; Surakhunthod, J; Sinpru, B; Sroichak, T; Archa, P; Thongpea, S; Paengkoum, S; Purba, RAP; Paengkoum, P","1"
"Tina W. Wey; Denis Réale; Clint D. Kelly","1"
"Sarah DeRaedt; Anandi Bierman; Peter van Heusden; Cameron Richards; Alan Christoffels","1"
"Wen Sang; Lin Yu; Li He; Wei-Hua Ma; Zhi-Hui Zhu; Fen Zhu; Xiao-Ping Wang; Chao-Liang Lei ","1"
"Sonali A. Deshpande; Matthew Meiselman; Robert H. Hice; Peter Arensburger; Crisalejandra Rivera-Perez; Do-Hyoung Kim; Rachel L. Croft; Fernando Gabriel Noriega; Michael E. Adams","1"
"Tullu Bukhari; Vishukumar Aimanianda; Emmanuel Bischoff; Emma Brito-Fravallo; Karin Eiglmeier; Michelle M. Riehle; Kenneth D. Vernick; Christian Mitri","1"
"El-Wakiel, N; Volkmar, C","1"
"Kejie Li, Zhanqi Dong; Minhui Pan","1"
"Perera, GSC; Afridin, MR; Adikari, AMAN; Heenatigala, PPM; Maduka, KLWT; Dunusinghe, SBK","1"
"Elena Crotti, Annalisa Balloi, Chadlia Hamdi, Luigi Sansonno, Massimo Marzorati, Elena Gonella, Guido Favia, Ameur Cherif, Claudio Bandi, Alberto Alma, Daniele Daffonchio","1"
"Sonia Pascoal; Judith E. Risse; Xiao Zhang; Mark Blaxter; Timothee Cezard; Richard J. Challis; Karim Gharbi; John Hunt; Sujai Kumar; Emma Langan; Xuan Liu; Jack G. Rayner; Michael G. Ritchie; Basten L. Snoek; Urmi; Trivedi; Nathan W. Bailey","1"
"Xu Qiyun; Wu Zhongzhen; Zeng Xinnian; An Xincheng","1"
"Beesigamukama, D , Subramanian, S , Tanga, CM","1"
"Rui Gao; Chun-Lin Li; Xiao-Ling Tong; Min-Jin Han; Kun-Peng Lu; Shu-Bo Liang; Hai Hu; Yue Luan; Bi-Li Zhang; Yan-Yu Liu & Fang-Yin Dai","1"
"Laksanawimol, P ; Anukun, P ; Thancharoen, A","1"
"Kinga Proc, Piotr Bulak, Dariusz Wiącek, Andrzej Bieganowski","1"
"Lee, JE; Jang, HS; Yun, YJ; Han, GB; Park, YK; Yang, YC; Jang, JH","1"
"Joel J. Brown, Sonia M. Rodríguez-Ruano, Anbu Poosakkannu, Giampiero Batani, Justin O. Schmidt, Walter Roachell, Jan Zima Jr, Václav Hypša and Eva Nováková","1"
"Wei Luo; Sethuraman Veeran; Jian Wang; Sheng Li; Kang Li; Su-Ning Liu","1"
"Fahmy, L; Ali, YM; Seilly, D; Mccoy, R; Owens, RM; Pipan, M; Christie, G; Grant, AJ","1"
"Emilie Lefoulon, Alex Truchon, Travis Clark, Courtney Long, Daniel Frey, Barton E Slatko","1"
"Opoku, O; Hamidu, JA; Adjei-Mensah, B; Quaye, B; Sasu, P; Benante, V; Amankrah, MA; Donkoh, A; Atuahene, CC","1"
"Ashe-Jepson, E; Cobo, SAA; Basset, Y; Bladon, AJ; Kleckova, I; Laird-Hopkins, BC; Mcfarlane, A; Sam, K; Savage, AF; Zamora, AC; Turner, EC; Lamarre, GPA","1"
"Jadhav, R; Milesh, L; Mathew, T; Madhu, R; Raghavendra; Maruti; Haider, S; Kushwaha, RK; David, A","1"
"Tijs J M van den Bosch, Cornelia U Welte","1"
"Wakana Nakane, Hisashi Nakamura, Takeru Nakazato, Natsuki Kaminaga, Miho Nakano, Takuma Sakamoto, Maaya Nishiko, Hidemasa Bono, Isao Ogiwara, Yhoshikazu Kitano, Kikuo Iqabuchi, Kaoru Kinoshita Richard J Simpson, Hiroko Tabunoki","1"
"Marie Legein, Wenke Smets, Karen Wuyts, Lien Bosmans, Roeland Samson, Sarah Lebeer","1"
"Joel J. Brown, Sonia M. Rodríguez-Ruano, Anbu Poosakkannu, Giampiero Batani, Justin O. Schmidt, Walter Roachell, Jan Zima Jr, Václav Hypša, Eva Nováková","1"
"A. S. Lestari; Sujaya Rao","1"
"dos Santos, ITBF; Pinheiro, HSS; Poderoso, JCM; dos Santos, VB; Chagas, TX; Ribeiro, GT","1"
"Brigitte Dauwalder; Susan Tsujimoto; Jason Moss; William Mattox","1"
"Kooienga, EM; Baugher, C; Currin, M; Tomberlin, JK; Jordan, HR","1"
"Merckx, T; Nielsen, ME; Kankaanpää, T; Kadlec, T; Yazdanian, M; Kivelä, SM ","1"
"Ju, RT; Zhu, HY; Gao, L; Zhou, XH; Li, B ","1"
"Zhuoxiao Sui; Qi Wu; Jin Geng; Jinhua Xiao; Dawei Huang","1"
"Laura E. Brettell, Declan C. Schroeder, Stephen J. Martin","1"
"Morales-Ramos, JA; Tomberlin, JK; Miranda, C; Rojas, MG","1"
"Opare, LO; Meister, H; Holm, S; Kaasik, A; Esperk, T","1"
"Waldan K. Kwong, Luis A. Medina, Hauke Koch, Kong-Wah Sing, Eunice Jia Yu Soh, John S. Ascher, Rodolfo Jaffé, Nancy A. Moran","1"
"Jin, YL; Cong, B; Wang, LY; Gao, YG; Zhang, HY; Dong, H; Lin, ZW","1"
"Andrea Osimani, Vesna Milanovic, Andrea Roncolini, Paolo Riolo, Sara Ruschioni, Nunzio Isidoro, Nino Loreto, Elena Franciosi, Kieran Tuohy, Ike Olivotto, Matteo Zarantoniello, Federica Cardinali, Cristiano Garofalo, Lucia Aquilanti, Francesca Clementi","1"
"Mlcek, J; Adamek, M; Adamkova, A; Matyas, J; Buckova, M; Mrazkova, M; Vicha, R; Vychodil, R; Knizkova, I; Volek, Z","1"
"Elena Facchini; Kriti Shrestha; Estelle van den Boer; Petra Junes2; Gaya Sader; Katrijn Peeters; Eric Schmitt","1"
"Bryan J. Cassone, Harald C. Grove, Oluwadara Elebute, Sachi M. P. Villanueva, and Christophe M. R. LeMoine","1"
"Norsa, L; Agostoni, C; Capriati, T; Campanozzi, A; Diamanti, A; Lezo, A; Gandullia, P; Spagnuolo, MI; Romano, C","1"
"Chu, JH; Weng, TS; Huang, TW","1"
"Leierer, D (Leierer, Dewey) ; Olmstead, M (Olmstead, Morgan) ; Oppert, B (Oppert, Brenda)","1"
"Isabela M Di Chiacchio, Elena Gómez-Abenza, Isadora M Paiva, Danilo J M de Abreu, Juan Francisco Rodríguez-Vidal, Elisângela E N Carvalho, Stephan M Carvalho, Luis David Solis-Murgas, Victoriano Mulero","1"
"Evenios Agathokleous, Zhaozhong Fend, Elina Oksanes, Pierre Sicard, Qi Wang, Costas J Saitanis, Valda Araminiene, James Blande, Felicity Hayes, Vincent Calatayud, Marisa Domingos, Starvos Veresoglou, Josep Penuelas, David Wardle, Alessandra De Marco, Zhengzhen Li, Harry Harmens Xiangyang Yuan, Marcella Vitale, Elena Paoletti","1"
"Austin H. Nguyen & Laura E. Altomare & M. Catharine McElwain","1"
"Marta Alves, Anabela Pereira, Patricia Matos, Joana Henriques, Claudia Vicente, Takyuya Aikawa, Koichi Hasegawa, Francisco Nascimento, Manuel Mota, Antonio Correia, Isabel Henriques","1"
"Feinstein, Julie","1"
"Veldkamp, T; van Rozen, K; Elissen, H; van Wikselaar, P; van der Weide, R","1"
"Tobias Uller; Roosa Leimu","1"
"Dongxu Xing; Qiong Yang; Liang Jiang; Qingrong Li; Yang Xiao;  Mingqiang Ye; Qingyou Xia","1"
"Lin, YH; Lee, YC; Chang, CC; Chen, YT","1"
"Green, E. A. and Klassen, J. L","1"
"Li, X (Li, Xian); Ye, ZP; Chen, JY; Zhu, JH; Han, DY; Wang, JY; Li, L; Fu, YG; Zhang, FP","1"
"Marcela Gomez, David Martinez, Marina Munoz, Juan David Ramirez","1"
"Sylvain Pincebourde; Jérôme Casas","1"
"Adámková, A; Mlcek, J; Adámek, M; Fisera, M; Borkovcová, M; Bednárová, M; Hlobilová, V; Vojácková, K","1"
"Campbell, M; Ortuño, J ; Stratakos, AC; Linton, M; Corcionivoschi, N; Elliott, T; Koidis, A; Theodoridou, K","1"
"Jiale Li, Chengcheng Li, Ming Wang, Lixiang Wang, Xiaobo Liu, Chenglong Gao, Lili Ren, Youqing Luo","1"
"Tomberlin, JK; Adler, PH; Myers, HM","1"
"T. Eriksson; C.J. Picard","1"
"Ilaria Biasato, Ilario Ferrocino,Sihem Dabbou, Rocchina Evangelista, Francesco Gai, Laura Gasco, Luca Cocolin, Maria Teresa Capucchio, Achille Schiavone","1"
"Gobbi, P; Martinez-Sanchez, A; Rojo, S","1"
"Matthew Greenwood, Kelvin Hull, Marissa Brink-Hull, Melissa Lloyd, Clint Rhode","1"
"Ramona Marasco, Marco Fusim Matteo Callegarim Costanza Jucker, Francesca Mapelli, Sara Borin, Sara Savoldelli, Daniele Daffonchio, Elena Crotti","1"
"Salam, M; Zheng, LY; Shi, DZ; Huaili, Z; Vambol, V; Chia, SY; Hossain, MN; Mansour, A; Eliw, M; Dong, MY; Shazadi, A; Ullah, E","1"
"Grausa, K; Siddiqui, SA; Lameyer, N; Wiesotzki, K ; Smetana, S; Pentjuss, A","1"
"Ania deutscher, Toni Chapman, Kucas Shuttleworth, Markus Riegler, Olivia Reynolds","1"
"Lei Gao; Itay Gonda; Honghe Sun; Qiyue Ma; Kan Bao; Denise M. Tieman; Elizabeth A. Burzynski-Chang; Tara L. Fish; Kaitlin A. Stromberg; Gavin L. Sacks; Theodore W. Thannhauser; Majid R. Foolad; Maria Jose Diez; Jose Blanca; Joaquin Canizares; Yimin Xu; Esther van der Knaap; Sanwen Huang; Harry J. Klee; James J. Giovannoni; Zhangjun Fei.","1"
"Shumo, M; Khamis, FM; Tanga, CM; Fiaboe, KKM; Subramanian, S; Ekesi, S; van Huis, A; Borgemeister, C","1"
"Antoine Guiguet, Issei Ohshima, Seiji Takeda, Francoise Laurans, Carlos Lopez-Vaamonde, David Giron","1"
"Domenico Tancredi; Irene Cardinali","1"
"Kim Rohlfing; Lennart Yue; Sebastian Franke; Cen Zeng; Lars Podsiadlowski; Susanne Dobler","1"
"Taylor J. Busby, Craig R. Miller, Nancy A. Moran, and James T. Van Leuven","1"
"Alexia L Carboni; Mark A Hanson; Scott A Lindsay; Steven A Wasserman; Bruno Lemaitre","1"
"Giulia Gaudioso, Giulia Marzorati, Filippo Faccenda, Tobias Weil, Fernando Lunelli, Gloriana Cardinaletti, Giovanna Marino, Ike Olivotto, Giuliana Parisi, Emilio Tibaldi, Kieran Michael Tuohy, and Francesca Fava","1"
"Valeriya Zabelina; Vyacheslav Klymenko; Toshiki Tamura; Karina Doroshenko; Haoyuan Liang; Hideki Sezutsu; and František Sehnal","1"
"Zarantoniello, M; Randazzo, B; Cardinaletti, G; Truzzi, C; Chemello, G; Riolo, P; Olivotto, I","1"
"Trevor M. Fowles; Christian Nansen","1"
"Elena Crotti, Luigi Sansonno, Erica M Prosdocimi, Violetta Vacchini, Chadlia Hamdi, Ameur Cherif, Elena Gonella, Massimo Marzorati, Annalisa Balloi","1"
"Iltis, C; Louâpre, P; Vogelweith, F; Thiéry, D; Moreau, J","1"
