"authors","paper_count"
"Angela Douglas","7"
"Malawey, AS; Zhang, H; McGuane, AS; Walsh, EM; Rusch, TW; Hjelmen, CE; Delclos, PJ; Rangel, J; Zheng, L; Cai, M; Yu, Z; Tarone, AM; Zhang, J; Tomberlin, JK","3"
"Niero, L; Norgren, R; Kumpiene, J; Jonsson, A","2"
"Walden K Kwong","2"
"Tobin J Hammer, Nancy A Moran","2"
"Patrick H. Kelly, Sarah M. Bahr, Tiago D. Serafim, Nadim J. Ajami, Joseph F. Petrosino, Claudio Meneses, John R. Kirby, Jesus G. Valenzuela, Shaden Kamhawi, Mary E. Wilson","2"
"St Leger, RJ","2"
"Hosseindoust, A; Ha, SH; Mun, JY; Kim, JS","2"
"Kim, B; Bang, HT; Kim, KH; Kim, MJ; Jeong, JY; Chun, JL; Ji, SY","2"
"Kökdener, M; Kiper, F","2"
"Voulgari-Kokota, A; van Loon, MS; Bovenkerk, B","2"
"Lucas P. Henry and Julien F. Ayroles","1"
"Valeria Silva; Angelina Palcios-Munoz; Mariano Volonte; Lia Frenkel; John Ewer; Sheila Ons","1"
"Ji-Hyun Yun, Seong Woon Roh, Tae Woong Whon, Mi-Ja Jung, Min-Soo Kim, Doo-Sand Park, Changmann Yoon, Young-Do Nam, Yun-Ji Kim, Jung-Hye Choi, Joon-Yong Kim, Na-Ri Shin, Sung-Hee Kim, Won-Jae Lee, Jin-Woo Bae","1"
"R A Kucuk","1"
"Yun Bai; Yuan He; Chu-Ze Shen; Kai Li; Dong-Liang Li; Zhu-Qing He","1"
"Park, Soon-Ik; Kim, Jong-Wan; Yoe, Sung Moon","1"
"Sarita Devi, Harvinder Saini, Sanedeep Kaur","1"
"Hao Zheng; Feifei Ren; Qiuyuan Lu; Zhenming Cao; Jichen Song; Min Feng; Jisheng Liu; Jingchen Sun","1"
"Nampijja, Z; Kiggundu, M; Kigozi, A; Lugya, A; Magala, H; Ssepuuya, G; Nakimbugwe, D; Walusimbi, SS; Mugerwa, S","1"
"Simone Costagli; Linda Abenaim; Giulia Rosini; Barbara Conti; Roberto Giovannoni","1"
"Rawski, M; Kieronczyk, B; Hetmanczyk, K; Józefiak, D; Skrzypczak, P; Mazurkiewicz, J","1"
"Zachary C. DeVries; Stephen A. Kells; Arthur G. Appel","1"
"Liu, SJ; Wang, J; Li, LX; Duan, YG; Zhang, XL; Wang, TH; Zang, JJ; Piao, XS; Ma, YX; Li, DF","1"
"Zhang, J (Zhang, Jie); Shi, ZH (Shi, Zhihui); Gao, ZH (Gao, Zhenghui) ; Wen, YT (Wen, Yiting); Wang, WQ (Wang, Wanqiang); Liu, W (Liu, Wen); Wang, XP (Wang, Xiaoping); Zhu, F (Zhu, Fen)","1"
"Philipp Engel, Nancy Moran","1"
"Jeanneth Pérez; Vivian Mendez; Boaz Yuval; Phillip W. Taylor","1"
"T. M. Jones; A. Balmford; R. J. Quin","1"
"Alessia Giannetto; Sabrina Oliva; Carlos Frederico Ceccon Lanes;Fabio de Araújo Pedron; Domenico Savastano; Cosimo Bavieraa; Vincenzo Parrinoa; Giuseppe Lo Paroa; Nunzia Carla Spanòc; Tiziana Cappelloa; Maria Maisanoa; Angela Mauceria; Salvatore Fasuloa","1"
"Taro Nakamura; Guillem Ylla; Cassandra G Extavou","1"
"Takacs, J; Bryon, A; Jensen, AB; van Loon, JJA; Ros, VID ","1"
"Bosheng Chen, Beng-Soon Teh, Chao Sun, Sirui Hu, Xingmeng Lu, Wilhelm Boland, Yongqi Shao","1"
"Eric W. Jones, Jean M. Carlson, David A. Sivak, William B. Ludington","1"
"Sabrina Lehmann; Bibi Atika; Daniela Grossmann; Christian Schmitt-Engel; Nadi Strohlein; Upalparna Majumdar; Tobias Richter; Matthias Weißkopf; Salim Ansari; Matthias Teuscher; Muhammad Salim Hakeemi; Jianwei Li; Bernhard Weißbecker; Martin Klingler; Gregor Bucher; Ernst A. Wimmer","1"
"Ido, A; Ali, MFZ; Takahashi, T; Miura, C; Miura, T","1"
"Daniel Gärttling, Sascha M Kirchner, Hannes Schulz","1"
"Serap Aksoy","1"
"Jian Xu, Xingyu Luo, Gangqi Fang, Shuai Zhan, Jun Wu b, Dun Wang , Yongping Huang","1"
"Qiu-Li Hou; Er-Hu Chen; Yi-Fei Xie; Wei Dou; Jin-Jun Wang","1"
"Daneil Gärttling, Hannes Schulz","1"
"Juan A. Morales-Ramos; Hans C. Kelstrup; M. Guadalupe Rojas; Virginia Emery","1"
"Chang, YW; Zhang, XX; Du, YZ","1"
"Le Boucher, R; Chung, WQ; Lin, JNK; Tan, LSE; Lee, CS","1"
"Carolyn E Riddell; Juan D Lobaton Garces; Sally Adams; Seth M Barribeau; David Twell; Eamonn B Mallon","1"
"Altmann, BA; Wigger, R; Ciulu, M; Morlein, D","1"
"Fabio Rangel, Paula Enes, Laura Gasco, Francesco Gai, Bela Hausmann, David Berry, Aires Olivia-Teles, Claudia R. Serra, and Fatima C. Pereira","1"
"Bosheng Chen, Ting Yu, Sen Xie, Kaiqian Du, Xili Liang, Yahua Lan, Chao Sun, Xingmeng Lu, and Yongqi Shao","1"
"Sankara, F; Sankara, F; Pousga, S; Coulibaly, K; Nacoulma, JP; Ilboudo, Z; Ouedraogo, I; Somda, I; Kenis, M","1"
"Klok, CJ; Harrison, JF ","1"
"Mancini, S; Fratini, F; Turchi, B; Mattioli, S; Dal Bosco, A; Tuccinardi, T; Nozic, S; Paci, G","1"
"Aparna Agarwal, Deepa Agashe","1"
"Mari Pölkki; Indrikis Krams; Katariina Kangassalo; Markus J. Rantala","1"
"Carolina Gonçalves Santos; Fernanda Carvalho Humann; Klaus Hartfelder","1"
"Dorothee Tegtmeier, Sabine Hurka, Patr5ick Kluber, Karina Brinkrolf, Phillip Heise, Andreas Vilcinskas","1"
"Lavinia Iancu, Iulia Roxana Angelescu, Victoria Ioana Paun, Carlos Henríquez-Castillo, Paris Lavin, Cristina Purcarea","1"
"Muangrat, R; Pannasai, S","1"
"Stefan Pentzold, Antje Burse, Wilhelm Boland","1"
"Noor Van Looveren, Dries Vandeweyer, Leen Van Campenhout","1"
"Soares, LJF; Ribeiro, GO; Freitas, DF; Madureira, ER; Aiura, FS; Maciel, MP; Nascimento, JCS; Ribeiro, AG; Santos, SHS; Costa, D","1"
"Amanda E Crofton; Emily L Cartwright; Anna A Feitzinger; Susan E Lott","1"
"Marijana Basica, Dominique Dardevetb, Peter Michael Abujac, Silvia Bolsegaa, Stéphanie Bornesd, Robert Caesare, Francesco Maria Calabresef, Massimo Collinog, Maria De Angelisf, Philippe Gérardh, Miguel Gueimondei, François Leulierj, Eva Untersmayrk, Evelien Van Rymenantl, Paul De Vosm, and Isabelle Savary-Auzelouxb","1"
"Yajie Guo, Qiannan Lin, Lyuyi Chen, Rebeca Carballar-Lejarazu, Aishan Zhang, Ensi Shao, Guanghong Liang, Xia Hu, Rong Want, Lei Xu, Feiping Zhang, Songqing Wu","1"
"John Doe; Jane Smith","1"
"Pabodha Weththasinghe, Sergio D. C. Rocha, Ove Oyas, Leidy Lagos, Jon O. Hansen, Liv T. Mydland, Margareth Overland","1"
"Gissela De la Cadena; Anna Papadopoulou; Jean-Michel Maes; Jesus Gomez-Zurita","1"
"Brenda Oppert; Aaron T. Dossey; Fu-Chyun Chu; Eva Šatović-Vukšić; Miroslav Plohl; Timothy P. L. Smith; Sergey Koren; Morgan L. Olmstead; Dewey Leierer; Gail Ragan; J. Spencer Johnston","1"
"Qesya Rodrigues Ferreira, Fabian Fellipe Bueno Lemos, Matheus Nascimento Moura, Jessica Oliveira de Souza Nascimento, Ana Flavia Novaes, Isadora Souza Barcelos, Larissa Alves Fernandes, Liliany Souza de Brito Amaral, Fernanda Khouri Barreto, Fabricio Freire de Melo","1"
"Runa Thrastardottir, Hildur Thora Olafsdottir, Ragnheidur Inga Thorarinsdottir","1"
"Agnieszka Kaczmarczyk, Halina Kucharczyk, Marek Kucharczyk, Przemysław Kapusta, Jerzy Sell, Sylwia Zielińska","1"
"Meiramkulova, K; Devrishov, D; Kakabayev, A; Marzanov, N; Kurmanbayeva, A; Adilbektegi, G; Marzanova, S; Kydyrbekova, A; Mkilima, T","1"
"Aniek B. F. Ivens, Alice Gadau, E. Toby Kiers, Daniel J. C. Kronauer.","1"
"Elizabeth B. Brown; Cody Patterson; Rayanne Pancoast; Stephanie M. Rollmann","1"
"Ardelan, A; Tsai, AN; Will, S; Mcguire, R; Amarasekare, P","1"
"Eke, M; Tougeron, K; Hamidovic, A; Tinkeu, LSN; Hance, T; Renoz, F","1"
"Harjoko, DN; Hua, QQH; Toh, EMC; Goh, CYJ; Puniamoorthy, N","1"
"Chengjun Li; Wei Wu; Jing Tang; Fan Feng; Peng Chen; Bin Li","1"
"Hannes A. Schraft; Chasity Bilbrey; Matt Olenski; Nicholas DiRienzo; Pierre-Olivier Montiglio; Anna Dornhaus","1"
"Alexander Keller, Quinn S McFrederick, Prarthana Dharampal, Shawn Steffan, Bryan N Danforth, Sara D Leonhardt","1"
"Reyes, M; Rodriguez, M; Montes, J; Barroso, FG; Fabrikov, D; Morote, E; Sanchez-Muros, MJ","1"
"Gebremichael, Askale; Kucska, Balazs; Ardo, Laszlo; Biro, Janka; Berki, Maria; Lengyel-Konya, Eva; Tomoskozi-Farkas, Rita; Egessa, Robert; Mueller, Tamas; Gyalog, Gergo; Sandor, Zsuzsanna J.","1"
"Margot W. J. Geerinck, Sara Van Hee, Gabriele Gloder, Sam Crauwels, Stefano Colazza, Hans Jacquemyn, Antonino Cusumano, Bart Lievens","1"
"Skotnicka, M; Mazurek, A; Kowalski, S; Pribis, P","1"
"Laura Figueroa, Jessica Maccaro, Erin Krichilsky, Douglas Yanega, Quinn McFrederick","1"
"Nguyen, DT; Bouguet, V; Spranghers, T; Vangansbeke, D; De Clercq, P","1"
"Johansson, F; Orizaola, G; Nilsson-Örtman, V","1"
"Parris T Humphrey, Noah K Whiteman","1"
"Yi Li; Xin Wang; Xiaoqian Xie; Qingsong Liu; Haonan Dong; Yong Hou; Qingyou Xia; Ping Zhao","1"
"Roethig, T; Barth, A; Tschirner, M; Schubert, P; Wenning, M; Billion, A; Wilke, T; Vilcinskas, A","1"
"Matan Shelomi, Meng-Kun Wu, Shu-Min Chen, Jing-Jiun Huang, Christopher Glen Burke","1"
"K. Tariq; W. Peng; G. Saccone; H. Zhang","1"
"Huang, JH; Jing, XF; Douglas, AE","1"
"Graziano Pizzolante, Chiara Codero, Salvatore M Tredici, Davide Vergara, Paola Pontieri, Luigi Del Giudice, Andrea Capuzzo, Patrizia Rubiolo, Chidananda N Kanchiswamy, Simon A Zebolo, Carlo Bicchi, Massimo E. Maffei, Pietro Alifano","1"
"Mazlum, Y; Turan, F; Yildirim, YB","1"
"Vesna Milanović, Andrea Roncolini, Federica Cardinali , Cristiana Garofalo, Lucia Aquilanti, Paola Riolo, Sara Ruschioni, Lorenzo Corsi, Nunzio Isidoro, Matteo Zarantoniello, Ike Olivotto, Simone Ceccobelli, Stefano Tavoletti, Francesca Clementi, and Andrea Osimani","1"
"Thorben Grau, Andreas Vilcinskas, Gerrit Joop","1"
"Sihem Dabbou, Ilario Ferrocino, Laura Gasco, Achille Schiavone, Angela Trocino, Gerolamo Xiccato, Ana C Barroeta, Sandra Maine, Dominga Soglia, Ilaria Biasato, Luca Cocolin, Francesco Gia, Daniele Michele Nucera","1"
"Marcela Gomez, David Martinez, Marina Munoz, and Juan David Ramirez","1"
"WEN SANG; LI HE; XIAO-PING WANG; KEYAN ZHU-SALZMAN; CHAO-LIANG LEI","1"
"Caleb Fischer, Eric Trautman, Jason Crawford, Eric Stabb, Jo Handelsman, Nichole Broderick","1"
"Vaga, M; Berggren, A; Jansson, A","1"
"Swinscoe, I; Oliver, DM; Ornsrud, R; Quilliam, RS","1"
"Eberle, S; Schaden, LM; Tintner, J; Stauffer, C; Schebeck, M","1"
"Paim, RMM; Araujo, RN; Pereira, MH","1"
"Ilaria Di Lelio, Giobbe Forni, Giulia Magoga, Matteo Brunetti, Daniele Bruno, Andrea Becchimanzi, Maria G. De Luca, Martina Sinno, Eleonora Barra, Marco Bonelli, Sarah Fruscianti, Gianfranco Diretto, Maria C. Digilio, Sheridan L. Woof, Gianluca Tettamanti, Rosa Rao, Matteo Lorito, Morena Casartelli, Matteo Montagna, Francesco Pennacchio","1"
"Archer, CR; Pirk, CWW; Wright, GA; Nicolson, SW","1"
"Yuki Mitaka; Eisuke Tasaki; Tomonari Nozaki; Taro Fuchikawa; Kazuya Kobayashi; Kenji Matsuura","1"
"Hansen, RJ; Nielsen, SHM; Johansen, M; Nielsen, FK; Dragsbaek, FB; Sorensen, OSB; Eriksen, NT","1"
"Stelios, V ; Ilias, G ; Ioannis, P ; Christos, A ; Elias, P ; Paschalis, F","1"
"Daniel Bang Jørgensen; Michael Ørsted; Torsten Nygaard Kristensen","1"
"Abarca, M; Spahn, R ","1"
"Vinicius A. C. de Abreu, José Perdigão and Sintia Almeida","1"
"Aurélien Vigneron; Charly Jehan; Thierry Rigaud; Yannick Moret","1"
"Beyers, M; Coudron, C; Ravi, R; Meers, E; Bruun, S","1"
"Ben-Yosef, M; Altman, Y; Nemni-Lavi, E; Papadopoulos, NT; Nestel, D","1"
"Meng, Yongqi; Zhang, Xiuxia; Zhang, Zelong; Li, Jiajun; Zheng, Peihua; Li, Juntao; Xu, Jiarui; Xian, Jianan; Lu, Yaopeng; Giannenas, Ilias","1"
"Balestrino, F; Puggioli, A; Gilles, JRL ; Bellini, R ","1"
"Ilaria Varotto Boccazzi, Matteo Ottoboni, Elena Martin, Franscesco Comandatore, Lisa Vallone, Thomas Spranghers, Mia Eeckhout, Valeria Mereghetti, Luciano Pinotti, Sara Epis","1"
"Anita Silver, Sean Perez, Melanie Gee, Bethany Xu, Shreeya Garg, Kipling Will, Aman Gill","1"
"Alissa Piekarski-Welsher; Elizabeth Greene; Kentu Lassiter; Byungwhi Caleb Kong; Sami Dridi; Walter Bottje","1"
"Carmen Scieuzo; Marisa Nardiello; Donatella Farina; Andrea Scala; Jonathan A. Cammack; Jeffery K. Tomberlin; Heiko Vogel; Rosanna Salvia; Krishna Persaud; Patrizia Falabella","1"
"Qingjie Cao, Jacob D Wickham, Li Chen, Faheem Ahmad, Min Lu, Jianghua Sun","1"
"Habte-Tsion, HM; Hawkyard, M; Sealey, WM; Bradshaw, D; Meesala, KM; Bouchard, DA","1"
"Oyoo, V; Riungu, JN; Dey, P; Kirimi, JG; Matheka, RM","1"
"Eva-Maria Willing; Christine Dreyer; Cock van Oosterhout","1"
"Star, L; Arsiwalla, T; Molist, F; Leushuis, R; Dalim, M; Paul, A","1"
"Kesen Zhu; Yanfei Chen; Lei Chen; and Hui Xiang","1"
"Woods, MJ; Cullere, M; Van Emmenes, L; Vincenzi, S; Pieterse, E; Hoffman, LC; Zotte, AD","1"
"Arabzadeh, G; Delisle-Houde, M; Tweddell, RJ; Deschamps, MH; Dorais, M; Lebeuf, Y; Derome, N; Vandenberg, G","1"
"Yulia Gnainsky","1"
"Chen, YB; Lawson, R; Shandilya, U; Chiasson, MA; Karrow, NA; Huyben, D","1"
"Veysel Bay, Seray Gür, and Oğuz Bayraktar","1"
"Ricardo Guerrero, Lynn Margulis, Mercedes Berlanga","1"
"Florent Dupriez; Agnès Rejasse; Alfredo Rios; Thomas Lefebvre; Christina Nielsen-LeRoux","1"
"Danielle N. A. Lesperance, Nichole A. Broderick","1"
"Felix Stiehler; Marvin Steinborn; Stephan Scholz; Daniela Dey; Andreas P. M. Weber; Alisandra K. Denton","1"
"Dahal, S; Jensen, AB; Lecocq, A","1"
"Dietz, C; Wessels, S; Sunder, A; Sharifi, R; Gahrken, J; Liebert, F","1"
"Junaid Ali Siddiquil, Muhammad Musa Khan, Bamisope Steve Bamisile, Muhammad Hafeez, Muhammad Qasim, Muhammad Tariq Rasheed, Muhammad Atif Rasheed, Sajjad Ahmad, Muhammad Ibrahim Shahid, Yijuan Xu","1"
"Yuan, Y (Yuan, Yi) ; Huang, WR (Huang, Wuren) ; Chen, KP (Chen, Keping) ; Ling, EJ (Ling, Erjun)","1"
"G. DOUGLAS INGLIS; DAN L. JOHNSON; MARK S. GOETTEL","1"
"Peng Chen; Wen-Fu Xiao; Min-Hui Pan; Jin-Shu Xiao; Yu-Jie Feng; Zhan-Qi Dong; Bang-Xing Zou; Li Zhou; You-Hong Zhang; Cheng Lu","1"
"Gang Ma; Chun-Sen Ma","1"
"Keren Levy; Bettina Fishman; Anat Barnea; Amir Ayali; Eran Tauber","1"
"Cremer, S; Armitage, SAO; Schmid-Hempel, P","1"
"Lianna W Wat; Zahid S Chowdhury; Jason W Millington; Puja Biswas; Elizabeth J Rideout","1"
"Laursen, SF; Hansen, LS; Bahrndorff, S; Nielsen, HM ; Noer, NK; Renault, D; Sahana, G; Sorensen, JG; Kristensen, TN","1"
"Eide, LH; Rocha, SDC; Morales-Lange, B; Kuiper, RV; Dale, OB; Djordjevic, B; Hooft, JM; Overland, M","1"
"Opare, LO; Holm, S; Esperk, T","1"
"Xiaoyun Wang1 & Qiao Gao1 & Xinhui Liu1 & Xiao-Ping Wang2 & Chaoliang Lei2 & Waheed A. A. Sayed3 & Fen Zhu1,2","1"
"Xu, XX; Ji, BB; Lu, RH; Ji, H","1"
"Vesna Milanovi ́c, Federica Cardinali; Lucia Aquilanti; Antonietta Maoloni; Cristiana Garofalo; Matteo Zarantoniello; Ike Olivotto; Paola Riolo; Sara Ruschioni; Nunzio Isidoro; Matteo Cattalani; Gloriana Cardinaletti; Francesca Clementi; Andrea Osimani","1"
"Chavez, M., Uchanski, M.","1"
"Veldkamp, T; van Niekerk, TGCM","1"
"Polidori C.; Ferrari A.; Borruso L.; Mattarelli P.; Dindo M. L.; Modesto M.; Carrieri M.; Puggioli A.; Ronchetti F.; Bellini R.","1"
"Changqing He, Jiaxing Lei, Yaling Yao, Xiangyong Q, jifa Chen, Kailae Xie, Xingju Wang, Qi Yi, Big Xiao, Songchang Guo, Xiaoyan Zou","1"
"Knapp, M; Rericha, M","1"
"Santosh Jagadeeshan; Rama S. Singh","1"
"Marco T. Tejeda; José Arredondo-Gordillo; Dina Orozco-Dávila; Luis Quintero-Fong; Francisco Díaz-Fleischer","1"
"Tomas N. Generalovic; Shane A. McCarthy; Ian A. Warren; Jonathan M.D. Wood; James Torrance; Ying Sims; Michael Quail; Kerstin Howe; Miha Pipan; Richard Durbin; Chris D. Jiggins","1"
"Lu Peng; Lei Wang; Yi-Fan Yang; Ming-Min Zou; Wei-Yi He; Yue Wang; Qing Wang; Liette Vasseur; Min-Sheng You","1"
"Simona Rimoldi, Elisabetta Gini, Federica Iannini, Laura Gasco, and Genciana Terova","1"
"Aisyah, HN; Athirah, ZAR; Hanani, WR; Arshad, SS; Hassim, HA; Nazarudin, MF; Ina-Salwany, MY","1"
"Fuso, A; Barbi, S; Macavei, LI; Luparelli, AV; Maistrello, L; Montorsi, M; Sforza, S; Caligiani, A","1"
"Williams, CM; Watanabe, M; Guarracino, MR; Ferraro, MB; Edison, AS; Morgan, TJ; Boroujerdi, AFB; Hahn, DA ","1"
"Dennis Beesigamukama, Benson Mochoge, Nicholas K. Korir, Komi K. M. Fiaboe, Dorothy Nakimbugwe, Fathiya M. Khamis, Thomas Dubois, Sevgan Subramanian, Musyoka M. Wangu, Sunday Ekesi, Chrysantus M. Tanga","1"
"Sasmita, HI; Tu, WC; Bong, LJ; Neoh, KB","1"
"Benjamin L. Hart","1"
"Matthew M. Ippolito, Joshua E. Denny, Charles Langelier, Cynthia L. Sears, Nathan W. Schmidt","1"
"Shelomi, M","1"
"Gabriela Maciel-Vergara, Annette Bruun Jensen, Jørgen Eilenberg","1"
"Osimani, A; Milanovic, V; Roncolini, A; Riolo, P; Ruschioni, S; Isidoro, N; Loreto, N; Franciosi, E; Tuohy, K; Olivotto, I; Zarantoniello, M; Cardinali, F; Garofalo, C; Aquilanti, L ; Clementi, F","1"
"Christopher Mitchell; Zachariah Wylde; Enrique Del Castillo; James Rapkin; Clarissa M. House; John Hunt","1"
"Kees van Oers; Krista van den Heuvel; Bernice Sepers","1"
"Rovai, D; Ortgies, M; Amin, S; Kuwahara, S; Schwartz, G; Lesniauskas, R; Garza, J; Lammert, A","1"
"Ian Keesey, Sarah Koerte, Tom Retzke, Alexander Haverkamp, Bill Hansson, Markus Knaden","1"
"Zadeh, ZS; Kheiri, F; Faghani, M","1"
"Calum Bridson, Latha Vellaniparambil, Rachel E. Antwis, Werner Müller, R. Tucker Gilman, Jennifer K. Rowntree","1"
"Philip T. Leftwich, Naomi V. E. Clarke, Matthew I. Hutchings, Tracey Chapman","1"
"Austin L. Hughes","1"
"Miebach, Anne-Carina; Bauer, Julia; Adamek, Mikolaj; Dietz, Carsten; Gaehrken, Jakob; Rosenau, Simon; Wessels, Stephan; Tetens, Jens; Suender, Angela; Jung-Schroers, Verena; Steinhagen, Dieter","1"
"Wada-Katsumata A; Robertson HM; Silverman J; Schal C.","1"
"Wen, FS; Yang, J; Huang, XR; Huang, XL","1"
"Kuppusamy, G; Kong, CK; Segaran, GC; Tarmalingam, E; Herriman, M; Ismail, MF; Khan, TM; Low, LE ; Goh, BH","1"
"Tianzhong Jing, Fuxiao Wang, Fenghui Qi, and Zhiying Wang","1"
"Martin Klingler; Gregor Bucher","1"
"Lee, KS; Yun, EY; Goo, TW","1"
"Guillaume Chomicki, Gijsbert D A Werner, Stuart A West, E Toby Kiers","1"
"Mark A. Hanson; Bruno Lemaitre; Robert L. Unckless","1"
"Delfino, D; Prandi, B; Ridolo, E; Dellafiora, L; Pedroni, L; Nicoletta, F; Cavazzini, D; Sforza, S; Tedeschi, T; Folli, C","1"
"Viola Günther,Dominique Waldvogel,Michael Nosswitz, OlegGeorgie, WalterSchaffner","1"
"Moritz Gold, Julia Egger, Andreas Scheidegger, Christian Zurbrugg, Daniele Bruno, Marco Bonelli, Gianluca Tettamanti, Morena Casartelli, Eric Schmitt, Ben Kerkaert, Jeroen De Smet, Leen Van Campenhout, Alexander Mathys","1"
"Martins, C; Cullere, M; Zotte, AD; Cardoso, C ; Alves, SP; de Bessa, RJB; Freire, JPB; Falcao-e-Cunha, L","1"
"Kevin Malod; Petrus D. Roets; Henrika Bosua; C. Ruth Archer; Christopher W. Weldon","1"
"Reategui, J; Barriga, X; Obando, A; Moscoso, G; Manrique, P; Salazar, I","1"
"Ko, HT; Cassidy, GJ; Shishkov, O; Aydin, E; Hu, DVL; Goldman, DI","1"
"De Leon-Ramirez, JJ; Garcia-Trejo, JF; Sosa-Ferreyra, CF; Martinez-Ramos, SA; Bottini-Cedeno, BS","1"
"Muhammad Salim Hakeemi; Salim Ansari; Matthias Teuscher; Matthias Weißkopf; Daniela Großmann; Tobias Kessel; Jürgen Dönitz; Janna Siemanowski; Xuebin Wan; Dorothea Schultheis; Manfred Frasch; Siegfried Roth; Michael Schoppmeier; Martin Klingler; Gregor Bucher","1"
"Kawasaki, K; Hashimoto, Y; Hori, A; Kawasaki, T; Hirayasu, H; Iwase, S; Hashizume, A; Ido, A; Miura, C; Miura, T; Nakamura, S; Seyama, T; Matsumoto, Y; Kasai, K; Fujitani, Y","1"
"Buonocore, F; Fausto, AM; Picchietti, S","1"
"Pullock, DA; Malod, K; Manrakhan, A; Weldon, CW","1"
"Lelanie Hoffmann; Kelvin L. Hull; Anandi Bierman; Rozane Badenhorst; Aletta E. Bester-van der Merwe; Clint Rhode","1"
"Katarzyna Ignasiak, Anthony Maxwell","1"
"Josué Barrera-Redondo; Daniel Piñero; Luis E. Eguiarte","1"
"Broeckx, L; Frooninckx, L; Slegers, L; Berrens, S; Noyens, I; Goossens, S; Verheyen, G; Wuyts, A; Van Miert, S","1"
"Juan J. Fanara; Maria I. L. Beti; Luciano Gandini; Esteban Hasson","1"
"Mohamed Mannaa; Abdelaziz Mansour; Inmyoung Park; Dae-Weon Lee; Young-Su Seo","1"
"Gebremichael, A; Szabo, A; Sandor, Zsuzsanna J.; Nagy, Zoltan; Ali, Omeralfaroug; Kucska, Balazs","1"
"Hwang, D; Lim, CH; Lee, SH; Goo, TW; Yun, EY","1"
"Hira, H; ul Abdin, Z; Tayyib, M; Arshad, M; Hussain, F; Abbas, SK","1"
"Kanakachari Mogilicherla; Amit Roy","1"
"Hui Wang, Kashif ur Rehman, Xiu Liu, Qinqin Yang, Longuyu Zheng, Wu Li, Minmin Cai, Qing Li, Jibin Zhang, Ziniu Yu","1"
"Hauke Koch, Vita Welcome, Amy Kendal-Smith, Lucy Thursfield, Iain W Farrell, Moses K Langat, Mark J F Brown, Philip C Stevenson","1"
"Beesigamukama, D., Mochoge, B., Korir, N., Menale, K., Muriithi, B., Kidoido, M., Kirscht, H., Diiro, G., Ghemoh, C.J., Sevgan, S., Nakimbugwe, D., Musyoka, M.W., Ekesi, S., Tanga, C.M.","1"
"Romi Novriadi; Simon Davies; Komang Indra Kurnia Triatmaja; Maman Hermawan; Endhay Kusnendar Muljana Kontara; Budi Tanaka; Ahmad Rinaldy; Jovano Erris Nugroho","1"
"Ouko, KO; Mboya, JB; Obiero, KO; Ogello, EO; Mukhebi, AW; Muthoka, M; Munguti, JM","1"
"Arena, R; Manuguerra, S; Curcuraci, E; Cusimano, M; Lo Monaco, D; Di Bella, C; Santulli, A; Messina, CM","1"
"Jack G. Ganley, Ashmita Pandey, Kayla Sylvester, ..., Thomas Bo¨ ttcher, Jiannong Xu, Emily R. Derbyshire","1"
"Napamanee Kornthong; Scott F. Cummins; Charoonroj Chotwiwatthanakun; Kanjana Khornchatri; Attakorn Engsusophon; Peter J. Hanna; Prasert Sobhon","1"
"Areerat, S; Chundang, P; Lekcharoensuk, C; Patumcharoenpol, P; Kovitvadhi, A","1"
"Liland, NS; Biancarosa, I; Araujo, P; Biemans, D; Bruckner, CG; Waagbo, R; Torstensen, BE; Lock, EJ","1"
"Zarantoniello, M; Randazzo, B; Gioacchini, G; Truzzi, C; Giorgini, E; Riolo, P; Gioia, G; Bertolucci, C; Osimani, A; Cardinaletti, G; Lucon-Xiccato, T; Milanovi, V; Annibaldi, A; Tulli, F; Notarstefano, V; Ruschioni, S; Clementi, F; Olivotto, I","1"
"Zarantoniello, M; de Oliveira, AA; Sahin, T; Freddi, L; Torregiani, M; Tucciarone, I; Chemello, G; Cardinaletti, G; Gatto, E; Parisi, G; Bertolucci, C; Riolo, P; Nartea, A; Gioacchini, G; Olivotto, I","1"
"Kojour, MAM; Han, YS; Jo, YH","1"
"Kerri L Coon, Shivanand Hegde, Grant L Hughes","1"
"Saridhi Chaturvedi, Alexandre Rego, Lauren K. Lucas, Zachariah Gompert","1"
"Kökdener, M; Gündüz, NEA; Zeybekoglu, Ü; Alakus, K","1"
"Staczek, S; Cytrynska, M; Zdybicka-Barabas, A","1"
"Moyers, Brook T.; Morrell, Peter L.; McKay, John K.","1"
"Sun, JR; Prabhu, A; Aroney, STN; Rinke, C","1"
"Zhaolu Zhu; Kashif ur Rehman; Yongqiang Yu; Xiu Liu; Hui Wang; Jefery K. Tomberlin; Sing‑Hoi Sze; Minmin Cai; Jibin Zhang; Ziniu Yu; inshui Zheng; Longyu Zheng","1"
"Chia, SY; Tanga, CM; Khamis, FM; Mohamed, SA; Salifu, D; Sevgan, S; Fiaboe, KKM; Niassy, S; van Loon, JJA; Dicke, M; Ekesi, S","1"
"Joachim R de Miranda, Fredrik Granberg, Piero Onorati, Anna Jansson, Asa Berggren","1"
"Christoph Sandrock, Simon Leupi, Jens Wohlfahrt, Cengiz Kaya, Maike Heuel, Melissa Terranova, Wolf U. Blanckenhorn, Wilhelm Windisch, Michael Kreuzer, and Florian Leiber","1"
"John S. Sproul; Scott Hotaling; Jacqueline Heckenhauer; Ashlyn Powell; Dez Marshall; Amanda M. Larracuente; Joanna L. Kelley; Steffen U. Pauls; Paul B. Frandsen","1"
"Lin, XY; Wang, FF; Lu, YT; Wang, JR; Chen, JW; Yu, YX; Tao, XY; Xiao, Y; Peng, Y","1"
"Oonincx, DGAB; van Broekhoven, S; van Huis, A; van Loon, JJA","1"
"Bujan, J; Kaspari, M","1"
"Lehmann, P; Javal, M; Terblanche, JS ","1"
"Liu, ZY; Minor, M; Morel, PCH; Najar-Rodriguez, AJ","1"
"Carlotta Savio, Loretta Mugo-Kamiri, Jennifer K Upfold","1"
"Moritz Gold, Melanie Binggeli, Fabienne Kurt, Tomas de Wouters, Markus Reichlin, Christian Zurvrugg, Alexander Mathys, Michael Kreuzer","1"
"Richard H. ffrench-Constant","1"
"Soumya Kar, Dirkjan Schokker, Amy Harms, Leo Kruijt, Mari Smmits, Alfons Jansman","1"
"Tong-Pu Li, Chun-Ying Zhou, Meng-Ke Wang, Si-Si Zha, Jie Chen, Xiao-Li Bing, Ary A. Hoffmann, Xiao-Yue Hong","1"
"Traynor, A; Burns, DT; Wu, D; Karoonuthaisiri, N; Petchkongkaew, A; Elliott, CT","1"
"Jingjing Zhang; Jiahui Li; Yuanzhi Peng; Xiaokun Gao; Qi Song; Hongyuan Zhang; Osama Elhag; Minmin Cai; Longyu Zheng; Ziniu Yu; Jibin Zhang","1"
"Yong Peng, Bo Lv, Zi-yan Lei, Yuan-de Peng, Li-jun Chen, Zhi Wang,","1"
"Zhuoran Xu; Quan Li; Luigi Marchionni; Kai Wang","1"
"Cynthia Lenaerts; Emilie Monjon; Joachim Van Lommel; Lina Verbakel; Jozef Vanden Broeck","1"
"Pilar Fernandez-Conradi, Bastien, Castaneyrol, Herve Jactel, Sergio Rasmann","1"
"Michael P Donovan, Peter Wilf, Ari Iglesias, N Ruben Cuneo, Contrad C Labandeira","1"
"Johnston, PR; Rolff, J","1"
"Sihem Dabbou, Angelo Lauwaerts, Ilario Ferrocino, Ilaria Biasato, Federico Sirri, Marco Zampiga, Stefania Bergagna, Giulia Pagliasso, Marta Gariglio, Elena Columbino, Carlos Garces Narro, Francesco Gai, Maria Teresa Capucchio, Laura Gasco, Luca Cocolin, Achille Schiavone","1"
"Richard D Horak, Sean P Leonard, Nancy A Moran","1"
"Peguero, DA; Moritz, G; Vandeweyer, D; Zurbrügg, C; Mathys, A","1"
"James F. Campbell; Christos G. Athanassiou; David W. Hagstrum; Kun Yan Zhu","1"
"Minmin Cai, Ruiqi Hu, Ke Zhang, Shiteng Ma, Longyu Zheng, Ziniu Yu & Jibin Zhang","1"
"Fernanda Kerche Paes da Silva, Dieter W Brück, Wolfram M Brück","1"
"Nichole A. Broderick","1"
"Chen Chen, Hongyi Chen, Shijie Huang, Taoshan Jiang, Chuanhong Wang, Zhen Tao, Chen He, Qingfeng Tang, Peijin Li","1"
"Pedro Jorge LouroCrugeira, Gustavo M.Pires-Santos, Susana C.P.S.de Oliveira, Fernando José Pires Sampaioa, Neandder Andrade Correia, Sandra R.C. de A. Fagnani, Fabio AlexandreChinalia, Paulo Fernandode Almeida, Antônio L.B.Pinheiro","1"
"Ribeiro, N; Costa, R; Ameixa, OMCC","1"
"Vilela, JD; Alvarenga, TIRC; Andrew, NR; McPhee, M; Kolakshyapati, M; Hopkins, DL; Ruhnke, I","1"
"Noor Ezlin Ahmad Basri, Nur Asyiqin Azman, Irfana Kabir Ahmad, Fatihah Suja, Nurul Ain Abdul Jalil, Nur Fardilla Amrul","1"
"Benjamin J. Krajacich, Diana L. Huestis, Adama Dao, Alpha S. Yaro, Moussa Diallo, Asha Krishna, Jiannong Xu, Tovi Lehmann","1"
"Katarzyna Złotko, Adam Wa´sko, Daniel M. Kami ´nski, Iwona Budziak-Wieczorek, Piotr Bulak and Andrzej Bieganowski","1"
"Lei, XJ; Kim, TH; Park, JH; Kim, IH","1"
"Man Wang; Yongjian Lin; Shiyi Zhou; Yong Cui; Qili Feng; Wei Yan; Hui Xiang","1"
"Michela Bertola, Franco Mutinelli","1"
"Prachom, N; Boonyoung, S; Hassaan, MS; El-Haroun, E; Davies, SJ","1"
"Alagappan, S; Rowland, D; Barwell, R; Cozzolino, D; Mikkelsen, D; Mantilla, SMO; James, P; Yarger, O; Hoffman, L","1"
"Min‑Jin Han; Hong‑En Xu; Xiao‑Min Xiong; Hua‑Hao Zhang","1"
"Uliana Semaniuk; Dmytro Gospodaryov; Khrystyna Mishchanyn; Kenneth Storey; Oleh Lushchak","1"
"Audrey-Anne Durand, Amelie Bergeron, Philippe Constant, Jean-Phillippe Buffet, Eric Deziel, Claude Guertin","1"
